Sentimen;Text
netral;unnesmenfess hidup ini pertaruhan nder tentukan prioritas dan pilhan pertimbangkan segala kemungkinan aku milih mundur dr giat 5 jauh hari kemaren buat ikut MBKM yang penting yakin lolos dulu hidup yang tidak dipertaruhkan tidak akan merasakan kemenangan
netral;upi Mau nanya dong tentang wacana  mbkm buat syarat sidang itu benar gk  aku mahasiswa semester 7 udh keterima pkl juga masa harus sambil mbkm jadi double gitu
positif;"Respon MBKM Prodi Arsitektur UMS Jalin Komunikasi dengan Alumni 

UMSnews UMSurakarta GenMu Unggul Mencerahkan Mendunia Muhammadiyah umssurakarta "
netral;dips kakak kakak teknik mau tanya klo teknik tuh pnting gak ikut mbkm  atau mendingan fokus kuliah biasa aja  no salty plis
netral;"code Serbaserbi MAGANG di program MSIB MBKM 
Ceritain pengalaman kalian yang pernah ikutan magang di program ini guys 
Sender rencananya mau daftar tapi pengin tau dulu insight dari alumni2 MSIB kek gimana terutama yang mitra magangnya di luar kota makasii "
netral;juni nnti misal lolos mbkm dan ga mengundurkan diri dr giat 5 bakal kena sanksi dan klo ga lolos mbkm dan uda mengundurkan diri dr giat 5 makin dilema bisa ikut lg di giat 7 nnt minta tlg kasi sender saran dan masukan dan alasannya apa ty
netral;ness sender skrg smt 6 lg bimbang bgt mau ikut giat 5 atau mbkm KMMSIB sender uda dftr giat 5 tp rencananya jg mau dftr mbkm sender pgn bgt ikut mbkm krn sebelumnya ga lolos dan klo uda terlanjur dftr mbkm hrs mengundurkan diri dr giat 5 maks konfirmasi tgl 3  cont
positif;keren deh orang yang mau dua kali ikut mbkm tapi dari filkom ub hehehe
positif;unnesmenfess klo msib enaknya dpt ilmu lebih tp inget matkul penting jgn lupa kayak metopen micro teaching klo pendidikan smt 5 tak tahan ga ikut mbkm soale byk matkul penting pengen dftr smt 6 malah smt 6 ga lolos badjingann skrg mo smt 7 disurh bertaruh milih GIAT or MBKM
netral;"Kemenag Buka Pendaftaran Seleksi Program Gelar Beasiswa Indonesia Bangkit 2023 selengkapnya 

kemenagri pendis beasiswa BIB ptkin iainternate mbkm humasiainternate "
positif;"Tinjau Pelaksanaan UMPTKIN 2023 Menag Terbuka Bagi Semua Agama Selengkapnya 

kemenagri menag pendis umptkin2023 iainternate ujian mbkm terbuka semuaagama humasiainternate "
positif;Sosialisasi MBKM by HIMA S1 Manajemen FEB UNAIR bersama Departemen Manajemen FEB UNAIR Sosialisasi ini sebagai salah satu program dengan tujuan untuk mendorong mahasiswa dalam menguasai berbagai keilmuan sehingga dapat dijadikan sebagai bekal memasuki dunia pekerjaan162023 
negatif;Dyastyop Saya tidak masup karena ngurus MBKM
positif;"sedih bgt gabisa ikut pmm padahal udh pindah kampus demi bisa ikut program mbkm haha but still ok 

happy for u yg lolos pmm 3 guysss bismillah batch 4 im cominggg mwehehhe"
negatif;AELAH W MSIH MBKM LG BULAN SEGITU 
positif; 2ndliliput collegemenfess Ikut magang nder lumayan biat nambah pengalaman juga Aku magang dari semester 5 awal2 ikut unpaid mbkm
positif;happlina sini aku prnh ikut mbkm soalnya
positif;"Sebenarnya sedari awal program iisma  student exchange sejenisnya outputnya agar para awardee iisma flexing lewat jualan kelas berkedok sharing season mentoring persiapan dll
Masih lebih baik magang MBKM bisa nerapin ilmu yg dipelajari secara langsung "
negatif;"NeracaEnergi Makanya sama aja boong wkwk di flyer namanya diskusi mah harus ada 2 pihak Ga cuma pihak dari IISMA doang 
Lagian ini kan termasuk program mbkm okelah kayak LPDP yg jelas bener2 ada outputnya Entah itu publikasi jurnal maupun kontribusinya buat Indo"
positif; Racunsanasini1 tanyakanrl Lolos pmm  mbkm  beasiswa wkwk
negatif;MBKM merdeka belajar tp bikin nggak merdeka anjir
positif;"Pancasila sebagai dasar negara
Sangat lengkap dan indah
Urutan silasilanya pun luar biasa
Pertanda dibuat dengan penuh hikmah

harijadipancasila pancasila pens kampusinovasi mbkm "
positif;Dorong Literasi Budaya Peserta MBKM Prodi PGSD UPI Cibiru Melaksanakan Program Bengkel Kreatif Berbudaya dan Berbahasa Daerah      
netral;Um Haloo di sini ada mahasiswa kimia yang pernah ikut mbkm khususnya magang Kalo ada rep yaa pengen nanya nanyaTIA
netral;Ugmfess mau nanya ini mbkm maksimal pilih 22 posisi kah Atau bebas ga ada maksimal applySekalian mau nanya aturan lengkap yg batch sekarang bisa liat dimana ya Thankyou
positif;sedih ga bisa ikut mbkm lagi smt depan 
positif;"KarantinaPalu Memaknai Hari Lahir Pancasila

Memaknai hari lahir Pancasila 1 Juni 2023 Seluruh ASN dan THL KarantinaPalu beserta mahasiswa MBKM Universitas Tadulako laksanakan upacara di halaman kantor pada kamis 162023
HarlahPancasila2023
KarantinaPertanianPalu "
netral;collegemenfess jualan online ikut mbkm jadi asisten dosenjurusan
positif;Dosbing nyuruh kelarin S1 35 tahun meanwhile gua ga mbkm yauda tapi ttp optimis
positif;tanyakanrl semoga dilancarkan skripsi dan paper nyaa lolos mbkm jugaa dan lancar rezekinya
positif;Enak kali ya bulan Juni lolos MBKM
netral;"di luar pembelajaran kelas Program ini turut dilaksanakan oleh berbagai universitas di Indonesia juga dilakukan oleh Universitas Syiah Kuala USK dengan memberi nama MBKM USK Unggul

Simak berita selengkapnya "
negatif;"Dana Insentif Mahasiswa MBKM Tak Kunjung Cair Ada Apa dengan MBKM USK

Merdeka  Belajar Kampus Merdeka MBKM salah satu program baru yang dikeluarkan oleh Kementrian Pendidikan Budata Riset dan Teknologi Kemendikbudristek dalam upaya meningkatkan potensi para mahasiswa "
netral;leokripikkenta collegemenfess mjb mbkm itu apa ya kak
positif;Akhirnya beres juga mbkm
negatif;knp ya ibu ni kayak ada dendam kusumat sama aku  aku slalu dpt BC sma beliau dlm mk apapun padahal tugas slalu dikerjain bahkan jdi mahasiswi bayangan tpii dpt BC katanya karna mini proposal  aku punya mbkm jd dikasi nilai rendah YA TAPI GA BC JUGA DONG GIMANA SII
negatif;tbtb kepikiran kalo misal ujian mbkm ini offline aku di malang sendirian dong orangorang pada pulkam kann udh kelar uas crycry
positif;wkwk marah grgr gabisa ikut mbkm soalnya mikirin himpunaaan bangsaaat nangis
positif;Ih ingin mbkm lagi tapi dah ikut 2x trs dah smt 8  
positif;collegemenfess Ikut mbkm yang bisa dapet uang saku magang jadi guru les jualan makanan part time di resto atau cafe jadi ojek online mahasiswa join gojek atau grab dll
netral;Aduh aku hari ini campur aduk banget ya Udah galo ditinggal bigbang galo gegabah potong rambut galo ternyata besok libur panjang galo mikirin surat mbkm galo lampu kamar mandi belom ganti mana udah gitu ada galo kebelet berak tapi takut gelap pula
positif;hiks baru inget besok long weekend semoga cukup deh buat daftar mbkm
positif;renwyi lu bayangin gua lagi workshop mbkm operatornya malah muter lagu blackpink sama newjeans
negatif;angkatan 20 ke bawah lulus modal intern di consulting firm berkat mbkm angkatan 18 ke atas lulus cuma modal hima doang mana gak achieve samsek yaudah pasrah kalau kegeser
positif;collegemenfess Ikut magang nder lumayan biat nambah pengalaman juga Aku magang dari semester 5 awal2 ikut unpaid mbkm sampe akhirnya smt akhir sekarang juga magang mandiri lagi
positif;UNJmenfess sini nder kita ngobrol kebetulan aku udah ikut mbkm 2x di smt 5  6 sekarang
positif;macreaii langsung kontak HR lewat linkedin aja da magang mbkm sepi banget gils ga ky smt kmrn
netral;itsfess Cb tny Dosen Koor MBKM Biasanya jg tau perihal konversi begini dan solusinya
positif;collegemenfess Kl uangnya gede ikut mbkm tp ya agak mumet tp kl mau yg santai sambil jualan makanan online
netral;unila untuk mahasiswa smstr 7 kan wajib ikut mbkm ya menurut kalian daftar ga yaa  sender pgn dftr km
positif;Ubsansfess braw Oknum R filkom SI yang lagi mbkm semangat ya
netral;cm buat kakakkakak yang udah pernah Studi Independen MSIB MBKM minta review nya donggg 
positif;Anugerah ini masingmasing dalam subkategori perguruan tinggi peduli disabilitas dan perguruan tinggi akademik penyelenggara program MBKM Mandiri 
netral;diinskyzz collegemenfess aku waktu itu ikut magang sejenis kayak mbkm tp bukan mbkm
positif;ugmfess huhu lebih baik yang mana yaaa ges  chat ku mau konsul seputar MBKM btw thx sebelumnya gess 
positif;Ugmfess Kak mau nanya dong kalo mau mbkm tapi cuma 18 sks itu brarti yg nentuin tuh kita mitranya atau siapa Terus nentuinnya pas pendaftarannya atau pas udah lolosnya ya Makasiiih
netral;ubsansfess kayaknya peraturan sem antara tiap fak tuh beda2 deh nder soalny di fakultasku yg bisa ambil cuma yg ngulang matkul atau yg ikut mbkm jdi coba tanya ke call center jurusan atau advo hima jurusanmu
negatif;ubsansfess ak gatau ya kebijakan semester antara di fakultasmu blh ambil buat percepat masa studiga tapi semisal bisa ambil yang matkul wajibwajib konsentrasi krn mbkm konversi dikit doang cuma 20 sks ak kmrn jadi tekor di akhir sks nya mending ambil sebelum km mbkm
negatif;pengen magang mandiri buat cari pengalaman tapi tementemen ku pada gamau karena udah mau ikut mbkm 
negatif;TahuKukus Soalnya dia intern mbkm jd y gt
netral;UGMFESS Guys ada yang daftar mbkm batch 5 ini aku mau nanya dong yang di sptjm harus pake materai asli ya kl ematerai boleh gak
negatif;dynsstr Ini pasti mbkm 
netral;"nyata yang dihadapi oleh mitraindustri
•
Ada Info penting nih untuk kamu mencari pengalam baru dan pastinya bermanfaat serta dapat memberikan feedback yang sangat bagus bagi karir nantinya dikarenakan kemendikbud sedang membuaka program MBKM yaitu MSIB batch 5 Memudahkan"
positif;dhikamplengi worksfess huhuu gitu yaa kak mungkin sama kali ya stepnya sama untuk MBKM ini btw thank you ya kak informasinya semoga lolos nanti kalau mau lamar lagii semangat kaa
positif;rollercoasterfl worksfess oh gitu jadi ada tahap berkas dlu baru ada tesnya yaa sama ga yaa sama MBKM inii huhu btw thank you yaa kakk
netral;unila mbkm itu menurut kalian worth it gasih soalnya katanya mendingan sekalian abis kkn aja
positif;cm aku saat ini semester 4 nanti agustus semester 5 apakah udh bisa ikut mbkm dan adakah yang bersedia untuk ku tanya mengenai mbkm  tia 
negatif;kencur0987 mulmatamu khilyaku Beda cerita yang keterima MBKM cukup buat keseharianyang foyafoya 
netral;Ukrida mendapatkan piagam penghargaan sebagai Apresiasi Pelaporan Indikator Kinerja Merdeka Belajar Kampus Merdeka MBKM Kategori Kelas yang Kolaboratif dan Partisipatif di Linkungan Lembaga Layanan Pendidikan Tinggi Wilayah III Tahun 2023 
negatif;"MBKM diwajibkan
RIP"
netral;cm mbkm kalau cuma itu tp ga dikonversiin boleh ga si
netral;"BeritaUNESA
Ramah Disabilitas dan MBKM Mandiri Bawa UNESA Raih 2 Penghargaan Kemendikbudristek

selengkapnya di


UNESA
UniversitasNegeriSurabaya"
positif;piipiiuww Sos mbkm nder
positif;azeridra Iya brow lebih asik laporan mbkm karena datanya uda ada jadi ketak ketiknya mudah wkwk
positif;Mengikuti Program MBKM Riset Mahasiswa Prodi Agribisnis Targetkan Luaran Jurnal Nasional dan HAKI  
netral;"Berasa war is over 
Masyaallah tabarakallah
Mulai dr bingung mbkm sambil bimbingan trs abis sempro buru2 mo nonton dream di jkt  after nonton lgsg gas lagi abis semhas jg 2 hari lari2 revisian  huhuhu makasiii banyak buat nct dream yg bener2 udh ngasih support  "
positif;"Tementemen yang udah pernah mbkm sebelumnya Mau liat laporan akhir sebelumnya dong buat referensi huhuu bingung mau mulai darimana ga dicopas kok 
mbkm zonamahasiswa"
positif;apa tiap semester mbkm aja ya anjir ga pake mikir dan nangis nilainya langsung bagus 
netral;Ngerjain laporan MBKM  Proposal skripsi
positif;mbkm apapun boleh asalkan jangan kkn dah gue asli
netral;UI Sabet Penghargaan Peserta MBKM Terbesar 13078 Mahasiswa Ikuti Program TempoTekno 
positif;collegemenfess smt 6 udh gawaktunya organisasi Ambil program MBKM aja nder
netral;abis kepanitiaan dan mbkm ini gua mau musnah
positif;collegemenfess mbkm laah 
netral;siapa yg gaboleh mbkm 
negatif;Kenapa sih MBKM banyak drama nya ga kampus ga dikti sama aja
negatif;terus ni laporan mbkm malah jadi belom aku kelarin hm
positif;bersama pandu n mbh fjr Goes to MBKM  
negatif;Ribet bgt mbkm anjir
negatif;" MBKM dah mau abis
 Skripsi gjls
 Lamaran gk diterima²
 Pelatihan gk kelar² karena main dua kaki
 Beasiswa dah abis
 Mimpi S2 dgn beasiswa semakin sulit

Yaaa bagaimanapun jg yg bisa dipercaya cm diri sendiri
Nangis Ya kalau bisa pengen teriak dipeluk Idk who"
netral;upi mau tanya dong kak aku mbkm di smt 5 kan ya nah smt 6 aku ngambil kkn kalau mau ikut program kkn rekognisi itu bisa nggak ya terima kasih
netral;UPIfess Nder mw nanya km rekognisi dr mbkm kah Kalau yg dr puspresnas misalnya PKM didanai gimana tah poin 2 and 3 nya
netral;Mending lulus tepat waktu tp ga ikut mbkm yg kemendikbud atau lulus telat tp ikut mbkm kemendikbud
positif;Program Magang dan Studi Independen Bersertifikat MSIB merupakan bagian dari program Merdeka Belajar Kampus Merdeka MBKM yang memberikan kesempatan kepada mahasiswa untuk menempuh pembelajaran di dunia kerja
positif;Ada informasi menarik nih dari program Merdeka Belajar Kampus Merdeka MBKM Tahun 2023
negatif;Mereka mau udah perform garagara ikut MBKM gue belum ngampu matkul ini  
netral; hi ada yang pernah bikin sptjm MBKM pakai emeterai itu kalau diprint tetap valid engga makasih sebelumnya
negatif;saat sender sem 6 kemarin Ip sender turus drastis  otomatis ngaruh di IPK  bisa ga si ikut AM di sem 7 jika IPK 295  Takut banget ya allah  Mana sama dosen disuruh ikut sem 7 mbkm tapi IPK gk bisa  Tolong pencerahannya rek 
negatif;um Maaf mau tanya  sender sekarang sem 6 tapi nanti sem 7 pngn ikut AM Tapi sem 6 kemarin seharusnya sender ikut mbkm tapi sender pngn mbkm di sem 7 nanti Berhubung sender gk ngambil mbkm di sem 6 nilai sender ada yang auto E karena harus sem 6 ikut mbkm Nah pada  cont
positif;Soalnya mau mbkm 
netral;kalo ikut mbkm bisa tetep ambil skripsi ngga sih
positif;Itulah pentingnya Mas Menteri bebaskan MBKM dr Tirani Bimbingan Skripsi S1 lbh dr 2 th  IPK yg berlebihan Buat Permennya yg batasi Bimbingan Skripsi S1 maksimal 1 th spy Mahasiswa tdk tua di Kampus Toh akhirnya HRD butuh tenaga yg Terampil Prima bukan Ijazah Prima 
positif;mochiorenji Astungkaraaaa paling serius tpi ga berharap banyak kek saingan gw banyak bngt pliss Ini udh acc di kampus gatau nanti di pihak mbkm nya gmna Ya astungkara lolos dah 
negatif;bisa2nya mbkm yg aku pilih ujian semua
netral;cm kak mau tanya dong di sini apa ada alumni magang mbkm tp ikutnya sem 4 kalau misalnya di syarat dan ketentuan mitra gak di mention minimal semesternya apa boleh anak sem 4 ikut tia pls jgn salty hehe
positif;"UI sabet penghargaan peserta MBKM terbesar

"
negatif;omg susah sekali ngurus berkas mbkm ini mana lagi di tengah uas belum lagi ternyata uas diundur smpe kamis depan yang artinya makin lama pulkamnya
netral;upi mau tanya dong kak ada yang pernah konversi program kkn sama program mbkm enggak
positif;"SahabatBahari kegiatan Mahasiswa MBKM bbpismg hari ini 3052023 mengunjungi Kantor 
 Distrik Navigasi Semarang
djptkkp 
kkpgoid 
saktitrenggono 
KKPThrive "
positif;tanyakanrl Lolos pmm  mbkm  beasiswa wkwk
netral;cm siang mau tanya buat yg udah atau mau ikut mbkm itu kalau surat rekomendasi dari kampus formatnya gak sama dengan template yg ada du website kampus merdekanya bisa nggak ya TIA
netral;Cm guys di sini ad yg ikut msib di sem 7 sks sender di krs kemungkinan nanti udh ga 20 sks kalo ky gtu konversinya gmn ya mbkm ky gtu hrs konversi 20 sks atau itu max thx
positif;BRGM meraih penghargaan dari Kemendikbud Ristek atas kontribusinya mendukung program Merdeka Belajar Kampus Merdeka MBKM 
negatif;joining mbkm sastra wayang is great until you face uas membuat artikel ilmiah penelitian lakon wayang
positif;sbmptnfess Bagus kok nder mbkm aja bagus22 yuk dah jgn sambat
negatif;Alah udah susah susah belajar SQL pas di CV buat MBKM malah lupa masukin
positif;"Dengan hadirnya seputar MBKM ini diharapkan mahasiswa dapat memilih dan menemukan program MBKM yang sesuai dengan minat dan kebutuhan sebagai bekal menatap masa depan terutama di dalam dunia kerja

Narahubung 
Ambro 082124661518ambrotedmond123 "
positif;untuk memberikan kesempatan bagi mahasiswa memperoleh pengalaman baru dengan mengambil mata kuliah di luar program studi Kali ini Seputar MBKM hadir sebagai sarana informasi terkait programprogram yang tersedia dalam MBKM 
netral;collegemenfess mjb emg boleh ya ikut lagi gitu soalnya kalo di MBKM ga boleh
negatif;Xavier317610665 collegemenfess masalahnya bnyk yg ikut mbkm atau di ganti magang mandiri dan bobot kegiatan tersebut tdk setara dgn matkul inti yg di konversi apalagi smpe 20sks al hasil lulusan tidak mencapai kompetensi bidangnya
negatif;Xavier317610665 collegemenfess kl yg aku rasain sama keresahan dosen2 aku di kmpus mahasiswa smst 67 wajib ikut mbkm padahal di smst itu matkul ini prodi karena wajib ikut mbkm jdi matkul inti tersebut banyak di konversi
netral;plis ini udh materai ke 3 ya allah smoga lolos mbkm amin 
negatif;Boleh minta hug nya  Masih bingung sama sedih gara2 gatau mau ngapain lagi kalo ga dibolehin ikut mbkm 
positif;"Mahasiswa Prodi Kimia FMIPA Unud Lakukan MBKM Riset di BRIN Bandung

"
negatif;makin kesini gue udah males bgt buat kuliah mungkin karena gaada temen dulu seneng banget ke kampus karena rame banyak temen memang kentot lah ini sistem gue gaboleh mbkm babi cepet selesai deh semester ini udah muak asksksk
negatif;Ikut Program MBKM Riset Prodi Agribisnis Target Luaran Jurnal Nasional Dan Haki 
negatif; annoying collegemenfess sumpah mending ganti mntri aja kurikulum bljr di acak2 mbkm lah ini apaan anjir marketplace guru
netral; umfess UM Cara ngeliat matkul yang keluar di semester antara gimana ya Yang MBKM emang gabisa ngeliatdaftar kah
netral;perlu disadari ketimbang fafifu kampus merdeka atau IISMA mending naikkan gaji guru biar enak dilihat angkanya 
netral;dips mau tanya kalau mau ubah data yg ga sesuai do portal kampus merdeka buat daftar magang tuh kemana ya ngurusnya
netral;CM magang kampus merdeka tutup pendaftaran kapan yaa
negatif;"dpt bocorancontekan tp IP dia BAGUUSSS wkskxkskdj blm lg kalo ada urusan kek msib kampus merdeka dll dia gamau cari tau sendiri dan selalu nanyain hal yg udah ada di web kek gamau effort 

tau kok gue ga boleh gini hrsnyaaa  tauu tp ga boong jg gue kesel bgt gmn cont"
negatif;remotivi Kalau mau baca berita di pikiran rakyat aja selama intern disana pas program kampus merdeka kita bener2 diajarin buat bikin berita yg kredible bukn modelan gini
netral;xprimordialnyx aku lagi buat laporan harian ini di kampus merdeka 
netral; whistleejeon ada yang pernah ikut studi independen kampus merdeka mau nanya2 dong guys
netral;ada yang pernah ikut studi independen kampus merdeka mau nanya2 dong guys
negatif;sedih amat si ni prodi ga support ikut kampus merdeka padahal motivasi gua ikut biar ga ketemu dosen2 ini lg di smt 5 
positif;andihiyat Thanks to kampus merdeka
negatif;bbh termin 2 msib kampus merdeka udah ada yang cair lah aku termin 1 aja belum cair sama sekali 
netral;collegemenfess Aku msih smt 6 tpi bantu jelasin ya nder worth it engganya itu tergantung kmu Klo kmu pengen ambil skripsi smt 7 mending gausah ambil msib karna klo udh ngeprogram kampus merdeka kita gabisa ambil skripsi Tpi klo kmu ga buru2 pengen ambil skripsi silahlan msib
negatif;collegemenfess Lebih ke intern sih Gue ga ambil intern apalagi magang merdeka karna emang ngincer yang 4 tahun Sistem di kampus gue juga agak ribet Terus buat lomba lomba juga susah karena gaada yg emang passion gue banget Sedangkan intern di merdeka tuh gak ada skill yang emang gue sasar
positif;Halo semua Aku lagi ngerjain final project diprogram Studi Independen binar academy x kampus merdeka batch 4 Kelompokku mau mengadakan sebuah project dengan tema Healthtech  mental health
positif;"urin skateboardeuwiro  kenangan waktu gue magang kampus merdeka bukber bareng2 terus nonton ini di smartv kelas terus sebelum pulang nyalain kembang api bareng2

gak kerasa udah 2 tahun lalu ya "
negatif;"collegemenfess 5 Personal project buat tp ga beres 
6 Magang mau ikut kampus merdeka kampus ga support berakhir cuman sebagai KPPKL"
negatif;teriak bgt apa2 kampus merdeka apa2 kampus merdeka kampus gue gak terdaftar
netral;Magang MSIB sama studi independen MSIB itu infonya dalam 1 opsi kan Kan di web ada opsi kampus merdeka Iisma Nah kalo magang msib itu 1 opsi sama studi independen cm
positif;collegemenfess gak nyobain magang merdeka kampus mengajar sama iisma nyesel abiisssss dulu jaman ku kuliah masih perkenalan kampus merdeka jd bener2 infonya gajelas skrg udh mulai di aplikasiin dan banyak testi plis benefit nya gila bgt sii pgn bgt experience nya 
positif;sbmptnfess dii binuss dongg soalnya tau gasih kalo misalnya kampus merdeka itu inspired by program binus yang mahasiswanya wajib ngikutin selama setahunbanyak beasiswa pulaakalo tertarikk atau mau tanyaa2 bisa dm aku yaaahh 
netral;akunitaaa hoshiiys collegemenfess itu liat masa expired nya di web kampus merdeka ya
netral;Ganti tah baju lapangnya tapi ko ada logo kampus merdeka Ini baju lapang kalo keluar kampus tah 
netral;txtdrkekes collegemenfess Bnr bgt ak mo daftar kampus merdeka aja akhirnya ga dibolehin ortu karena takut covid kalo sampe keluar kota
positif;elisabethmurni Program Kampus Merdeka Mbak sudah jalan beberapa cycle Pertukaran pelajar antar pulau seIndonesia utk 1 semester Menarik konsepnya
positif;"FUSHIGUR00 wish aku tahun ini 
lancar UAS nya dan mendapatkan IPK yang memuaskan bisa pulang ke rumah dan bisa lolos program kampus merdeka"
netral;kapan ya uin ada program kaya kampus merdeka gitu
negatif;Tolong dong kampus merdeka ini memungkinkan mahasiwanya untuk memilih mengikuti program program magang di perusahaan2 besar tanpa mengikuti matkul di semester itu tapi kenapa hasilnya mahasiwanya kayak ga tau apa apa ini meresahkan saya resah
positif;kampus merdeka belajar merdeka 
netral;"daftar kampus merdeka pengen keterima
daftar kampus merdeka takut keterima"
netral;"Konteks Studi Independen Kampus Merdeka
Mending ngambil studi independen dari hal yang spesialisasinya disitu dan 90 materi udah kupelajari atau ngambil materi baru yang bukan spesialisasikuwalau masih berhubungan "
netral;unnesmenfess Emg ada magang merdeka Perasaan adanya Kampus Merdeka deh trs msib itu salah satu program dlm kampus merdeka
negatif;"gajelas anjing tbtb sakit anak magang berasa robot emg kalo kata gua mah gausa ikut magang kampus merdeka

ga dapet merdeka merdeka nya
dapet hikmah sm pelajaran hidup iya"
negatif;sumpah anak kjmu mending gausah daftar program kampus merdeka dhh
netral;cm UIN udah bisa ikut program kampus merdeka seperti IISMA dan Bangkit kah
positif;"1 Lolos Sbmptn Utbk di Univ Impian
2 Lolos Pertukaran Mahasiswa ke Medan
3 Semester 2 udah ikut program kampus merdeka
4 Ikut Program Kemenpora by Duta Inspirasi Indonesia di Gedung Pemuda Kemenpora
5 Juara Lomba Nasional Mahasiswa 2023 terhitung semenjak semest 1  "
positif;KampusMerdeka Di sini kpn y trotoarnya jd lebar nyaman banget hmmm 
negatif;kalo liat komen IG nadiemmakarim isinya keluhan masalah semua dia ke paris london kerjasama pendidikan kampus merdeka dll yg sbnernya efek buat solusi masalah ini kecil  kerjasama yg beliau lakukan berefek selama ini cm buat kampus gede atau sekolah mahils
negatif;klmholic Same energy dgn temenku yang minta ttd wd untuk keperluan kampus merdeka dari jam 8 sampe jam 4 belom ada kabar 
netral;cm guys ada yg pernah ikut magang kampus merdeka gak Komen yah kalo ada
negatif;sedikit kesel karna program pmm kampus merdeka ga ada pas aing awal kuliah
positif;ivandila di kampusku anak sem 2 kmrin oengumuman kampus merdeka lolos pertukaran mahasiswa di UGM nderr
negatif;apaajadehh111 Hai Diah Selama mengikuti proses pelaksanaan program Kampus Merdeka BI KMBI berdasarkan ketentuan dari Kementerian Pendidikan Kebudayaan Riset dan Teknologi bahwa peserta yang mengikuti program KMBI tidak diperkenankan melakukan kuliah lain 1
netral;Mungkin dia kebanyakan ikut program kampus merdeka yg nilai matkulnya dikonversi 
positif;"911jakey 50k yukk udh sering buat magang apply ln kampus merdeka dll

WA 
"
negatif;nekat ikut kampus merdeka pdhl ip terakhir kecil wkwkwkw malah insecure sm tmn2 yg lain gede bgt ip nya anjrit
netral;gojuosatorou oiyaaa itu bagian program kampus merdeka nya nadiem naj kayaknya mmg baru terjadi 3 kali makanya namanya pmm3 wkwk
negatif;mau buka kampus merdeka ternyata nik aku beda help gimanaaaaa inii formadugm
netral;cm jadi kadiv kepanitiaan  disambi magang kampus merdeka di semester 5 yay or nay
netral;cm kalian waktu magang kampus merdeka sambil megang kepanitiaan gitu ngga kira2 bisa ngga kepegang semisal ikut dua2nya tolong sarannya dong makasih
netral;Work gimana pandangan kalian mengenai anak magang via kampus merdeka
negatif;Suka heran sama banyak mahasiswa sekarang Organisasi mahasiswa minim peminat Kampus Merdeka juga mulai menunjukkan trend menurun kompetisi yang diadain kampus  kampus juga udah sepi peserta kemana ya kirakira mahasiswa hari ini
netral;  IISMA tuh program kampus merdeka kan yah itu kita di biayain kuliahnya  dapat uang transporbiaya hidup juga gak Atau sistem IISMA tuh gimana yah thx ya 
netral;bankindonesia Halo min magang kampus merdeka yg bulan agustus itu kan katanya wfhwfohybrid kalau waktunya itu bertabrakan dengan kuliah reguler gimana ya solusinya apa bisa wfh saja
netral;cm teman2 ada yang pernah ikut program magang kampus merdeka gak Boleh tolong reply mau nanya2 Soalnya aku pengen ikut TPI masih ragu gitu makasih guys
negatif;sumpah tbtb disuru absensi buat kampus merdeka AT THIS TIME ALLAH
netral;"5 Masuk ke akun kampus merdeka
6 Klik Lengkapi Dokumen
6 Isi CV terbaru lebih baik Transkrip terbaru dan KTP 

 Kesalahan data pada dokumen berakibat penolakan
 Pemalsuan dokumen berakibat masuk ke daftar blacklist "
netral;rent haloo adakah disini bestie rent yang pernah daftar MSIB kampus merdeka pengen aku ajak ngobrol yuk drop diri kaliann thanks a lot
