Sentimen;Text
positif;"Waktu itu bikin atm bri buat mbkm kan terus pas ke cabang nya ternyata disruuh bikin online gitu Tapi bukan itu yang mau aku ceritain 
Ini tentang kerennya bapak satpam yang kerja di cabang itu Mungkin semua bapak satpam di setiap bank itu keren "
negatif;jurusan nyuruh mbkm tapi konversi sulidddddd 
netral;collegemenfess Setauku aku yaa tapi gatau bener atau engga  Semisal kita daftar program mbkm dan lolos tapi ngga jadi diambil nantinya tu kaya nama kita di pusat udah ada tandanya gitu Jadi semisal kedepannya klo kita daftar program mbkm lagi jadi bahan pertimbangan mereka
positif;"ubsansfess Dah mayan ntue ikut MBKM
Gaada kata telat nder sender gausah iri sama yang lain karena ini bukan balapan Sender fokus aja sama target sender apa aja yang sender mau capai di tahun ini"
positif;manifesting smester 7 mbkm dapet dosbing skripsi yang enak 2023 sempro
netral;"umfess Ada yang dari IKOR ga
Kalian ada MBKM ga"
netral;um ada yang mau daftar mbkm terutama msib dan udah bikin akunnya gaak aku mau bikin akunnya tapi masih gak yakin soalnya dosen pa sama jurusanku diem diem aja makasihh
positif;"readinorth kalo ga salah inget simpedes daftar BRI grgr ikut mbkm 

pakenya line bank grgr ga ada admin samsek ga kena fee juga kalo mau tftopup"
netral;cm aku mau ikutt magang program mbkm sem depan trs ada kolom portofolio kalo anak akutansi gitu portofolionya isinya apa ya makasii
positif;ubsansfess gapapa nder each person have their own way ikut mbkm dah bagus itu klo mau menuhin linkedIn banyak caranya bisa ikut course online atau remote atau parttime atau klo mau santai dulu ya gapapa sambil bikin plan mau yang difokusin semangatttt
netral;cm aku sender  krn byk yg nnya aku gaikut krn wkt itu mbkm dn gbs ambil matkul tsb jd ak bljr mandirii metopen gt 
negatif;Braw Udah mau semester 7 tapi kenapa ya kek masih iri banget lihat temen di LinkedIn pengalamannya banyak banget sedangkan aku baru 2x ikut Program MBKM dan ga ada magang termasuk telat ga sih mau produktif di semester 7baru mau magang gitu
positif;collegemenfess Waktu angkatan kating 1619 masih diwajibin nder soalnya kek sekalian nyusun pondasi buat sempro Tapi pas angkatan gw bisa kena konversi MBKM Merdeka belajar  semester ini lagi nyusun Bab 13
negatif;mbkm smt 7 kenapa mitra nya dikit banget asli
negatif;riill magang mbkm yang gabisa konversi ini membunuhku 
netral;um Halo warga yuem adakah disini yang mau daftar mbkm msib Tolong reply dibawah yaa mau tanya terkair pengajuan SR SPTJM sekalian cari temen Makasih 3
positif;undipmenfess bca nder buat pemakaian utama gue jg dlu mbkm buat rek bri cm buat nerima tf mbkm doang abs itu gue tf lgi ke bca lbh gmpg bca soalnya atmnya jg banyak di indoalfa ada jd g rame2 bgt
netral;dips Mau buka rek baru tapi bingung antara 2 ini Bc4 karena agak lebih percaya milik swasta untuk jangka panjang trus jarang error mbankingnya atau br1 karena kalau suatu saat butuh buat program2 kuliah kayak mbkm yg harus pakek itu tp br1mo sering errorMenurut  cont
netral;Um Ada anak pend matematika 20 yg skrg ikut mbkm rencana nya gaikut semester antara besok ini
positif;Ga dape tiket coldplay ga dapet tiket niki semoga dapet mbkm
positif;collegemenfess aku nderr kupu tapi punya pengalaman mbkm sama volunteer
netral;upnsby yang mbkm udah pada kekonversi semua tah di krs siamik 
positif;collegemenfess Mbkm ajaa
netral;cm kak ada yg pernah ikut program mbkm riset dari Elsa BRIN  Cerita dong gimana testimoni nya Makasih
netral;DraftUINJKT Daftar dulu dimana gitu ada tim mbkm nya
negatif;mentang mentang duit mbkm pada cair flexing di tiktok 
netral;collegemenfess Magang MBKM sih tpi hehe
negatif;mau mbkm di dyandra tp kok kg ga buka anjg 
netral;ubsansfess masing fakultas beda kebijakan tp fia ada sih yg mbkm lalu
netral;ubsansfess iyaa nder aku abis mbkm kemaren sidang
netral;braw Setelah MBKM tuh laporan akhirnya apakah harus ada presentasi seperti seminar skripsi gitu Yang pernah ataupun ngerti mohon petunjuknya TIA ^^
netral;"rrsstuvwxyz collegemenfess Beda ga si kk
Cubaliat akun msibmbkm nya"
netral;ugmfess misi izin tanya ada kakak yg sebelumnya pernah ikut magang mbkm dan tipe yang konversi sks gitu ga ya mau tanya sedikit kalo berkenan makasii
positif;justsitnobserve Nestle buka mbkm Coba ae coy
netral;rek uner yg pernah ngurus transkrip nilai buat mbkmsejenisnya tolong kasih tau alurnya dong  makasih yg udah jawab 
netral;ngurus berkas mbkm makalah uas parttime bakal slesai
netral;mari kita zoom mbkm dulu
positif;collegemenfess Aku ada nder kupu kupu tp alhamdullilah lolos terus beasiswa dan mbkm kalau mau liat dm aja gk ikut samsek organisasi di kampus
negatif;undipmenfess sebenernya konsul kaprodi itu udah cukup tp balik lg tergantung kebijakan fakultas masing2 kemarin aku ikut mbkm bukan kampus mengajar dari kendala irs absensi konversi matkul  kkn yg handle ya kaprodi doswal malah ga ngapa2in
positif;Terus MBKM menawarkan opsi magangTA supaya lulus lebih cepat Lulus cepat supaya cepat juga jadi budak korporat sebelum kemampuan berpikir kritis terasah baik Mantap emang 
netral;deng denggggg tbtb ada mbkm lanjutannnnnn
negatif;Bingung pengen ikut magang MBKM tpi posisi yang ada cuman di pulau Jawa aja
netral;collegemenfess Cv nya ats terus kalo ada pengalaman organisasi daftar si atau mbkm nya yang relevan sm pengalaman yang didapet dan kalo bisa sesuai jg sm jurusannya
netral;hanjyysung collegemenfess klo berkas aku urus dikampus kak jadi di prodiku dosen yg dipilih yg urus berkas msib mbkm ini coba kamu tanya2 sm alumni msib dari kampusmu kira2 alur pemberkasan disana gimana
negatif;Ut Nanya dong sender ini atau siapapun yg tau ini info dari mana ya Trus beneran klo alih kredit ga bisa ikut program ini Sedih bgt padahal aku jg alih kredit ga sampe setengahnya di acc  jatohnya jd lumayan ngulang dari awal trus  rencana pengen ikut mbkm dll cont
netral;"collegemenfess Hai nder aku izin menjawab ya tanyakan ke pihak kampus nder Biasanya disetiap kampus ada PIC yang mengurusi MBKM 

"
negatif;Minggu ini hectic bgt anjirngurus tugas Sama ngurus pendaftaran mbkm nguras emosi bgt
negatif;"lilyfrze collegemenfess Ga bisa daftar kak
Kampus aku ga ngasih izin
Benarbenar minimal semester 5 saat mendaftar
Padahal mah di web MBKM minimal semester 5 saat program MSIB dimulai"
positif;UMW Kendari Gandeng LLDIKTI IX Sosialisasi RPL dan Pendampingan MBKM  lewat ZonaSultraid
positif;"Mungkin adekadek mahasiswa harus Eksplor ya syarat dan ketentuannya sehingga minat pertukaran mahasiswa itu berkembang Karena itu skema MBKM ya harus dimanfaatkan dan membuka wawasan dan mengembangkan jejaring ujar WR IV

"
netral;UTmenfess Klo g slh ada formnya d grup mbkm d tele
netral;kalo udah daftar salah satu program mbkm tp blm pengumuman boleh daftar program yang lain juga gasi mbkm
netral;gzreentea ahyeonreeves collegemenfess Formattemplate nya udh dari mbkm nya kak
positif;collegemenfess Apply sebanyak banyaknya sesuai jurusan kamu nanti suka cek berkala ke email sama akun mbkm nya Kalo rezekinya pasti lolos jangan lupa siapin CV sertie sama surat rekomendasi dari kampus
netral; collegemenfess cm ambil mbkm minimal semester berapa ya
netral;cm ambil mbkm minimal semester berapa ya
netral;peachjaemine collegemenfess mbkm itu program kementerian yg didalamnya ada msib kkn wirausaha dll
netral;collegemenfess intinya program mbkm tuh berkasnya harus sesuai salah dikit aja gugur ntar kalau msib jangan lupa bikin CV formatnya ATS Friendly
netral;Ikut mbkm 3 kali bisa gasi
positif;Manifesting diterima magang mbkm di semester 5 2023
positif;minjuensiti JKT48Kai ikut yang MBKM aja lumayan
negatif;minjuensiti JKT48Kai LAMA BANGET ANJIRRRRR LU IKUT YANG MBKM
netral;peachjaemine collegemenfess Msib adalah program dari mbkm
netral;collegemenfess Bedanya msib sama mbkm tuh apaa ya
netral;collegemenfess Mf agak oot kalian ada gak yang ikut rpogram MBKM tapi pas udh smt 8 ini
netral;deeliciouse caratstalk Aisee eh kp tu apah Aku skrg lagi mbkm
negatif;collegemenfess Ke Hoki an sih wkwk  aq ketrima mbkm di United Tractors tapi gajadi tak ambil
positif;"Foto bersama kontingen Pramuka IAIN Ternate seusai pelaksanaan upacara pelepasan oleh Rektor IAIN Ternate Jumat 1952023
kemenagri ptkin pramuka iainternate mbkm PWN2023 "
negatif;aduh mbkm dah buka tp perusahaan yg gue mau ga ada
netral;ugmfess bisa ambil sempro sambil mbkm di semestet yg sama ga ya
negatif;Pengen nangis huhu nyesel gajadi ikut mbkm semester ini  Matkul semester ini susah susah bgt gakuatt
netral;xpressoOoo telyufess kp kalo ga salah minimal 2 bulan tapi aku 6 bulan kemarin soalnya sekalian konversi mbkm
negatif;mbkm kali ini riwehh bgttt nngiss dah ga sanggup
negatif;collegemenfess Sama nder fakultas aku jg gitu huhu sedih bgt pdhl dulu fakultas lain ada kating sedivisi ku di MBKM Batch 3 bisa sambil skripsian
positif;Kemarin gaji MBKM baru turun jd langsung traktir keluarga mam bubur kwang tung enak bgt HSHSHSH trs beli bukuwww 
negatif;Hezoui  gua pernah bilang gak sih sistem mbkm tuh emang nyiksa wkwkwkwk
negatif;Kenapa mbkm gaada yang di surabaya atau malangg semuanya di jkt ini gimana yaa mana butuh konsul buat skripsj kan gak mungkin tiap minggu pp jakarta malang bisa tekor
netral;IamPrasPrasetja hanya dalam waktu 6 minggu Pokoknya tuh materi dipadetin sepadetpadetnya Kita juga diputer ke berbagai setting kesehatan komunitas kerja dan sekolah Ini juga masuk sebagai pilihan kegiatan MBKM buat jurusan aku Tapi setelah ikutan ini aku mikir2 lagi buat lanjut S1
negatif;Kata gw aneh ini mitra mbkm Tapi yaudahlah Dikerjain aja
positif;sunflower0606 setinggi ekspektasi terhadap program mbkm
netral;UPIfess Ngaruh di MBKM semua kegiatan mbkm harus terdaftar di PDDIKTI
positif;urg ikut program mbkm meunang 750rb sabulan gas teu euy tp rada sieun euy can pernah miluan nu kararieu soalna
positif;"Halo Sahabat Psikologi 

Sosialisasi MBKM 2023 akan diadakan nih  Sahabat Psikologi semester 6 wajib untuk hadir ya Informasi selengkapnya silakan cek pada slide berikut  Jangan sampai terlewatkan "
netral;Semangat yang kkn jends aku tim ngga kkn krn udah konversi pas mbkm kemaren aslinya mah pengin ikut kkn hwaaaa
positif;Sukseskan Program KKNT MBKM UPNVJT Adakan Kegiatan Monev bersama Dosen Pembimbing Lapangan dan Perangkat Desa  upnvjtofficial
positif;Unsoedfess1963 skripsi sih puas2in mbkm di smst 56
negatif;bagusadisatya Aamiin kak Beberapa yg bagus dan dewasa tp I can say 80 dr anak2 MBKM di kantorku ini attitudenya krg banget Tp aku yakin masih ada yg punya good attitude diluar sanaa
positif;worksfess itu dulu nder sekarang udah berubah sejak ada mbkm apalagi lulusan bangkit ngeboost cv banget
positif;banyak banget yg harus diselesaiin hari ini screening lpj tugas kantor tugas mbkm rancang rancang kyaattt yuwhuu zemangtttzzz
negatif;" relasi kuasa itu nyata y ikut program Kampus mengajar dan dpt DPL kampus lain Tp sayangnya beliau gak mau ngeapprove laporan di akun mbkm mhs kalo laporan DPL belum kami kerjain Pdhl itu tugas beliau
Mau lapor takut krn aku kipk takut ngaruh ke ipk ku nnti Niatnya cont "
positif;almondnetta mbkm si soalnya kek magang gtu
netral;"Pmm or mbkm 

Menurut kalian better yg mana"
negatif;beruntung1 upiinunyu tanyakanrl murid smp emang gajentot semua pertanyaanya apa lagi murid sd dulu pernah mbkm kampus mengajar sering di chat random sama anak murid
netral;hari ini direach up sama dua penerbit dan gw masih kagatau mo bales apa asli pusing kepala gw mikirin mbkm
negatif;ROLLE COASTER Bgtttt punya temen MBKM INIIIII BANGKEE LAAAHHH
netral;cm guys disini ada yang datanya gaada di pddikti tapi tetep bisa mbkm gak ya aku panik banget data aku gaada di pddikti atau mungkin ada yang pernah ngalamin hal serupa terus diatasinnya kayak gimana mohon infonya guys
netral;inainoana udah ambil surat mbkm ni gua kalo keterima gas full time
positif;Revolusi Mental ASN  Aparat lainnya dlm hal kecepatan  keterbukaan Pelayanan Masyarakat sdh berhasil ini hrs diakui Yg blm berhasil MBKM di PT dr penjajahan Bimbingan Skripsi yg berlama2 di era digitalMas Menteri buat Permen ttg Bimbingan Skripsi S1 maksimal 1 th spy hemat 
negatif;collegemenfess lagi sibuk uas pas ikut program mbkm nenek meninggal orang tua hampir cerai ditinggalin pacar sampe sekarang masih ngerangkak buat jalan
netral;umfess Sini nder ngga yakin lengkap si tapi sependek pengetahuanku sebagai mahasiswa mbkm semester ini
positif;contohnya ini disaat kita bingung gimana mbkm ketua angkatan ku berinsiatif membuat ini Padahal mungkin untuk urusan begini harusnya kita bersaing tp di angkatan aing ketuanya tidak membiarkan satupun orangpun tertinggal dibelakang 
netral;collegemenfess aku pas mbkm batch 3 ikut stupen ttp dapet kaya biasa nder kurang tau tapi kalo batch yg skrng
netral;um ada yg mau jelasin secara lengkap sistemnya mbkm itu gimana aku masih bingung bgt gaada info apapun trs nanti kita cari sendiri atau diarahin buat pilih tempat dll
negatif;Ikutan mbkm udah niat buka rek baru Eh 2 sem kedapetan yg unpaid semua wkwk hangus aja tu duit 200k cuman buat potongan biaya admin doang
netral;cm kalo misal kita ikut mbkm itu kita harus siap ditempatin dimana aja ya
netral;cm mbkm bisa dua kali gak misal tahun ini magang tahun depan iisma
netral; guys kalo ikut magang mbkm semester 7 tu gpp kan ya
negatif;HELP GWEH GATAU CARA BIKIN CV BUAT MBKM SKSKSHSK
negatif;Manifesting lolos mbkm atau msib batch ini aamiin
negatif;sedih banget anjirr pengen ikutan riset mbkm di brin tapi mengingat biaya hidup di tangsel semahal itu harapan gue pupus seketika
netral;goodluck yang war hari jumat lawan war kalian anak mbkm abis gajian
positif;"Sehingga dihasilkan output berupa press release yang menjadi bukti bahwa petinggi siap untuk menyelesaikan segala problematika yang telah disebutkan

Sebagai mahasiswa Universitas Negeri Malang mari tetap peduli dan kawal semua kebijakan MBKM yang dikeluarkan oleh pihak UM"
negatif;"dan menuntut untuk segera menyelesaikan segala problematika yang telah dirasakan oleh mahasiswa selama melaksanakan proses MBKM di UM 
Seperti yang telah dicantumkan di postingan di atas pelaksanaan alur pergerakan untuk ke tahap audiensi membutuhkan waktu "
positif;Pada 14 Maret telah dilaksanakan audiensi Mahasiswa bersama pihak petinggi rektorat di Universitas Negeri Malang  mengenai perbaikan tata kelola MBKM di Universitas Negeri Malang 
netral;"PRESS RELEASE  PERBAIKAN TATA KELOLA MBKM UM

Halo Mahasiswa FEB UM 

Tahun ini MBKM telah dilaksanakan selama hampir satu semester Tetapi apakah tata kelola MBKM di Universitas Negeri Malang sudah memudahkan mahasiswa dalam proses pelaksanaannya "
negatif;Skrng gw bingung mau iku kkn mbkm apa yg reguler
negatif;"l

dr kmrn kaprodi gabisa ditemui td dosen yang pro kalau satu angkatan dialihkan dr kkn reguler ke kkn mbkm milih buat ga kelas dosen yg pro dan berani masuk kena bulan bulanan amukan massa "
netral;Cm mau tanya dong aku mau daftar mbkm berkas berkasnya Itu diprint dulu baru di scan apa di scan aja langsung pdf ya
netral;checkoves mbkm magang yaa atau apah
positif;Program Evaluasi KKNT MBKM UPNVJT Mahasiswa KKNT di Kecamatan Dringu Laksanakan FGD serta Kegiatan Monitoring dan Evaluasi  upnvjtofficial
negatif;littlehugyou Ambis bat keknya bocah²an 20 latihan plkh rame bat rame padahal yang ambil matkul bisa diitung jari sisanya mbkm semua wkwk
netral;jends yang mau kkn itu pendaftaran yg ada lampiran dokumen tu diserahin scr langsung ke fakultas apa itu diunggah onlen juga sender lg mbkm diluar pwt soalnya
positif;Kejar Status Bebas Stunting Mahasiswa KKNT 44 MBKM UPNVJT Lakukan Penyuluhan dan Implementasi Pola Hidup Bersih Sehat di Desa Randuputih  upnvjtofficial
netral;ugmfess kits tu bisa dapetin timeline pendaftaran MSIB dimanaaa ya kalau sender semester 5 mau mbkm daftarnyan kapn yaa makasi ol
netral;"yang bahas tentang program mbkm utk sem 3 mungkin kalo sem 5 keatas udah pada banyak info

excited bgt sampe dengan pas iseng cari tau syarat daftar ternyata ada syarat tidak pernah melakukan cuti selama perkuliahan langsung 

kok bisa kelewat  kepedean sii"
netral;fvckkklyfe worksfess Dulu ikut MBKM yaa full konversj
positif;harusnya gw mbkm aja annjir
negatif;hari ini sampai jangka waktu yang belum ditentukan aku close dulu lagi kejar tugas akhir mbkm
positif;"temanpemilih
Rabu 175 Ketua dan Sekretaris KPU Kota Denpasar menerima kunjungan dari Dosen Undiknas Denpasar dalam rangka supervisi mahasiswa MBKM Undiknas

Ngulati Denpasar Shanti
kpuri kpubali
kpumelayani pemiluserentak2024
tahapanpemilih2024mulai "
netral;mutualku siapa yg perna ikutan mbkm plis share ur experience aku kepo pengen ikutan tp takut 
netral;UPI Share pengalaman kalian dong sisi positif dan negatif ikut MBKM MSIB P3K dan Kamjar Sender mau ikut buat semester depan tapi bingung mau ambil apa  Tia
netral;nctzenbase Seorang mahasiswi lg magang mbkm yg menjalani harinya dengan yaallah yaallah yaallah kuatkan sebentar lg beres
negatif;alur mbkm kok kaya susah ya aku jadi ciut bgt 
negatif;Asli banget ini mah wahai bapakibu panitia MSIB dan MBKM saya beneran tinggal punya uang 10rb  Masa iya saya berangkat ke kantor tempat magang harus jalan kaki  Tolong kejelasan pencairan bbh MSIB batch 4 nya  nadiemmakarim KemdikbudRI ItjenKemdikbud ditjendikti
netral;Jends cv mbkm isinya apa aja ya
positif;"Prodi Tadris Matematika IAIN Papua Kenalkan Kurikulum MBKM
"
positif;"Siapkan Sukseskan Perkemahan Wirakarya Nasional Perguruan Tinggi Keagamaan XVI 2023
kemenagri ptkin PWN2023 iainternate mbkm pramuka humasiainternate "
negatif;caratstalk Mahasiswa magang yg lagi nangis mulu mikirin luaran mbkm nya sehingga butuh bersandar di dada jeon wonwoo
negatif;w pas umur 20 lagi nangisin semester yg isinya tugas kelompokan semua mana kelompoknya kek tai mbkm juga gabisa rekog kknmagang 
negatif;"collegemenfess 1 mabok bikin desain ui ux karena ikut mbkm salah satu mitra
2 agak ga paham tapi dipaham pahamin pake flutter
3 mencoba memahami gimana cara baca simbol diagram UML
4 memandangi gedung baru di kampus berharap prodiku pindah situ  "
negatif;oatschoco eh tp bener lohhh aku aja mbkm kek halahh dah lahh  ambil hikmah nya aja 
negatif;Habis ini giliranku semoga rejeki biar gk perlu ikut mbkm 
positif;collegemenfess cari lab yang spesifiknya di bidang aku terus email ke mereka tp kalau case lain biasanya jinguk ke portal mbkm sih
positif;cm Share pengalaman kalian dong sisi positif dan negatif ikut MBKM MSIB P3K dan Kamjar Sender mau ikut buat semester depan tapi bingung mau ambil apa  Tia
negatif;"manifesting gak ikut mbkm karena semester ini udah semhas

aamiin"
positif;cm gaess aku kan sebelumnya udh magang desain grafis tp mau daftar mbkm posisi uiux designer kira2 ada posisi ini gk ya
netral;11fess gais sender mau cari kandidat pembicara buat seminar hibah mbkm sender dengan kriteria di gambar ya Kalau ada yang punya kenalan atau rekomendasi bisa reply ya nanti sender cari infonya Makasih 
negatif;terus tidur di kereta tapi hari ini lehernya pegel banget apakah ini penyebabnya dan ga tau knp tj ke arah kantor tuh skrg penuh terus kayaknya siih karena banyak mhsw mbkm dan jadinya di tj suka ada ribut kecil ibu2 vs penumpang yg mau naik
netral;sunkissedflwerr mbkm
negatif;Buset ni mbkm dh mau batch 5 aja padahal bbh batch 4 belom turun heheheheh
netral;"terkait Pelaksanaan Program MBKM UGM pada tahun 2023 Survei ini bertujuan untuk mengetahui Tingkat Kepuasan serta Kritik membangun dari temanteman mahasiswa UGM terkait Program MBKM yang tengah dijalani 

Survei dapat diisi pada  
"
positif;manifesting bisa magangmbkm di jakarta
negatif;stress tugas berentet  mikirin mbkm perut kek dipelintir 
positif;upi angkatan 20 ini wajib ikut mbkm 2 kali
positif;"Dukung Program MBKM Kilang Pertamina Plaju Jalin Sinergi Dengan Universitas Muhammadiyah Palembang  lewat rakyatpembaruancom

pertamina 
Palembang"
negatif;pengen kuliah kaya biasa aja deh drpd mbkm gini ribet bgt
netral;infoooo dan sharing magang MBKM donggg
negatif;"cm aku udah smt4 aku di kampus susah banget adaptasi secara sosial dan akademik tapi alhamdulillah setelah empat semester akhirnya dapet temen di kampus

ternyata mereka semester depan hampir semuanya mau mbkm aku jadi ngerasa ketinggalan sendiri mau ikut coba cont"
netral;"cm magang nya mbkm semester ini udah rilis semua perusahan dan posisinya

atau ada kemungkinan nambah lagi "
positif;"Propo propo propo
Kelar mbkm "
positif;"Tidak lupa disampaikan juga harapan agar mahasiswa perikanan menjadi champion yang setelah lulus nanti menjadi leading dalam pengelolaan komoditas perikanan termasuk rajungan yang lestari

APRI MBKM rajungan industri teknologi entrepreneurship rajunganindonesia "
positif;"Dengan pembelajaran langsung di tempat kerja mitra magang mahasiswa akan mengasah soft skills dan hard skills yang akan menyiapkan mereka untuk memasuki dunia karier

Program Magang MBKM menyediakan dua jenis program yaitu Program Magang Flagship dan Program Magang Mandiri "
negatif;another pusing dgn mbkm
netral;AnjaySetengah Potret mahasiswa mbkm kecuali yang di brin
positif;"ya ampun satu bulan lagi tepat hari ini masa magang MBKM MBSI ku kelarr i am enjoy so much to be here  tapi apa daya harus balik jogja buat kembali ke kampus 

will miss you a lot Indofood Jakarta Selatan dan semua konser konsernya"
positif;jskinanthi lho mbak bukannya bareng kan mbak kinkin ikut mbkm
positif;lolos mbkm kmi who
netral;umfess coba aja nder seingetku akun mbkm tuh ngelink sama profile pddikti kamu nah itu liat aja nanti yang tetera di pddikti semester berapa tp gapapa bikin akun mbkm dulu aja
netral;um guys kan aku mau ikut mbkm yang magang msib tuh  nah yang jadi pertanyaan aku kan min sem5 sedangkan aku baru selesai semester 4 apakah aku udah masuk kategori sem 5  yang aku tau karena blm krs secara ga langsung status nya masih semester 4 dong butuh pencerahan  cont
netral;Utk bebaskan MBKM dr penjajahan Bimbingan Skripsi era Digital yg bertele2 baiknya Mas Menteri buat Permendikbud Ristek yg batasi Bimbingan Skripsi S1S2S3 maksimal selama 1 th Ini utk kurangi beban mental Mahasiswa  beban finansial OrgtuaWali MahasiswaHRD tdk butuh Skripsi 
netral;ValeSombers Im good maybe Otw boncos bayar kas mbkm  ketarketir banyak tugas  bentar lagi UAS
positif;kegblgnunfaedh tahun dpn si semoga keterima mbkm atau kkp di tmpt yag bags
positif;collegemenfess Kampus ku ada kalo ikut program MBKM ga ikut KKN alias dikonversi nder
negatif;"Capek banget jadi tulang punggung kelompok
Ternyata semester 6 gue bener bener di uji buat jadi tulang punggung kelompok
Bukan 2 atau 3 kelompok kek dulu
Ini 9 kelompok coyy gue tulang punggungnya
Yaallah kalau ini adalah salah satu ujian menuju mbkm magang Hammba ridho"
positif;gapernah tau kl move on bisa segampang dan secepet ini wkwkwkwk ada untungnya jg kuliah smt 6 di kampus tanpa mbkm dsb
netral;asfuturewifeyy collegemenfess Buat magangnya tuh magang mandiri ya kak Atau ikut mbkm
negatif;agak nyesel milih magang MBKM di semester 6 ini huhu
positif;seandainya ga ikut mbkm pengen bgtt lanjutin penelitian di lapas
negatif;"day 50

hahahaa kuranh brp hari lg aku akan keluar tp aku blm menyelesaikan output mbkm ini anjai huuaaa sibuk bgt senin kali ini"
positif;"Jawaban dosenku seperti ini
Klu msh dlm kuota besar kmgkn diterima

Semoga diterima karena ini salah satu magang yang oke selain dapat sertifikat ini juga Magang MBKM banyak benefit yang bisa didapatkan"
positif;"Semester 5 mau ikut Magang MBKM Puji Tuhan dicarikan oleh fakultas dan sudah memilih tema magang dan mendaftar ke instansinya Meskipun tidak bergaji tapi fasilitas disediakan Namun masih rancu apakah diseleksi kembali atau langsung lolos 
 next"
negatif;literally questioning why the f i took this MBKM ALIRAN LINGU
netral;ihopesook collegemenfess Yaa ditinggal KRSnya diganti matkul buat konversi mbkm
negatif;plis lah ini kenapa gak bisa daftar dua sih padahal di web mbkm jelas boleh daftar dua prefer magang tapi kok gak yakin keterima 
positif;"Ngopi Inspirasi bareng Lokalate

Halo SobatMelekGue 

Program Magang dan Studi Independen MSIB MBKM Batch 5 udah dibuka nih Buat kamu yang pengen tau tipstips lolos MSIB dan pengalaman magang terus pengen tau tentang dunia FMCG 

 "
netral;Penerapan Nilai Bela Negara Dalam Kegiatan Magang Mbkm Mandiri Mahasiswa Akuntansi UPN Veteran Jawa Timur  
positif;Untar Kembali Raih Predikat Implementator MBKM Terbaik 
netral;ugmfess hai gais mau nanya aja nich ada ga ya mbkm yang dapat uang saku dr perusahaan jadi dapat double gt dr kemdikbud dan perusahaan Makasi yang udah jawab 
negatif;seriusan dr yg awalnya gak dulu malas pak gak menarik langsung ih kalau gitu mah menarik ga si apa mbkm aja ya
positif;"sosialisasi kukerta mbkm setengah jalan msh ga menarik

that one expert marketing lecturer jadi
orang orang anjir menarik juga ya"
positif;"Pembinaan budaya membaca bermula dari rumah dan tentunya perpustakaan di rumah memberi pengaruh yang besar dalam agenda melahirkan generasi pembaca

 Mohd Khair Ngadiron Pengarah Majlis Buku Kebangsaan Malaysia MBKM"
positif;topokki14 collegemenfess mbkm iya kkn iya doakan aku ya nder 
negatif;Kalau gue ngeluh di sw takutnya mereka liat dan gak jadi ikut MBKM kayak gue GAK BOLEH So yaudah gue akan ngeluh di sini
positif;Jusmarkisa unnesmenfess aku jga beli iPhone XR dari uang magang MBKM meskipun aku penerima KIP itupun uang magangnya dipotong uang KIP
positif;Hi Student AI Mastery Mimin kasih tau nih salah satu project terbaru dari student AI Mastery yang dibuat oleh Student MBKM Batch 4 yaitu Fayza Aprilliza yang bisa jadi inspirasi kalian
positif;"Mahasiswa program studi Hukum Tatanegara Fakultas Syariah IAIN Ternate melakukan foto bersama seusai melangsungkan Moot CourtPraktik Peradilan Semu di Laboratorium Syariah Kamis 1152023
kemenagri ptkin iainternate mbkm "
