Sentimen;Text
negatif;ugmfess rekening buat msib kampus merdeka cuma bisa BRI ya
positif;AmanillahH Kalo ga bisa cari aja talent kampus merdeka tuh banyak yg bagus eks intern startup digital wkwkw
netral;Guys mau nanya enakan daftar kampus merdeka semester 5 atau 6 yak
positif;Mendikbudristek Apresiasi Komitmen UNY Implementasikan Program Kampus Merdeka  
negatif;cm kalian yg daftar program kampus merdeka bisa ga verifikasi rekening bank Sender kok gabisa diverifikasi trs ya padahal udh bener noreknya ada yg tau solusinya 
positif;bersyukur banget batch 4 kemarin ketolak jalur kampus merdeka dan keterima jalur mandiri di bangkit Alhasil masih punya jatah dua kali buat ikut kampus merdeka  emang ga ada yang kebetulan keknya ya 
negatif;collegemenfess yg ikut kampus merdeka kan dapet fee dari kemendikbud nah kalo banyak yg ngerasa gaikut tp namanya terdaftar peserta jadi fee nya kemana dong 
negatif;" MagangStudi Tolong Kami Bantu Viralkan Supaya Cepat Diurus

Kami Mahasiswa Magang Kampus Merdeka sudah kerja hampir 45 bulan tapi"
netral;cm misi mau nanya buat yang udah daftar akun kampus merdeka dapet activation emailnya berapa lama yaa aku coba daftar belum dapet soalnya udah coba minta kirim lagi tapi tetep belum masuk makasi semuanya
negatif;tanyakanrl wkwkw mentor kampus merdeka saya malah pap
netral;Di program kampus merdeka MSIB itu kita magang cari instansi sendiri atau hanya milih dk pilihan yg ada di website kampusmerdeka itu ya Cm
netral;chuuuseyeo sbmptnfess halo kak bisa buka dm gak ya aku mau nanya seputar kjmu dan kampus merdeka
negatif;program kampus merdeka semester ini Takutnya ga diterima krna udh lebih dari 2 kali Solusinya gimana ya
negatif;cm mau tanya dong klo ikut kampus merdeka gitu maksimal cmn boleh 2 kali ya Ini sender iseng cek di pddikti trs keterangannya disitu sender udah ikut 3 kali program kampus merdeka padahal aslinya sama sekali ga pernah ikut Trs rencananya sender baru mau daftar cont 
positif;dionpouw Iya weh agak nyesel kenapa ga join pas kuota kampus merdeka masih bisa 
positif; SevensRoad77 Mbahwo999 Miduk17 Nadim nggak beres gmn Kampus merdeka sama kurrikulum merdekanya bagus kok
netral;kalo mau join program kampus merdeka agk susah karna kita dibawah naungan kemenag bkn kemendikbud solusinya hrs mau sksd sm anak fakultas lain atau deketin dosen2 buat dptin informasi kalo udh deket pasti ditelfonin kdg diajak makan bareng2 dibantuin
positif;collegemenfess di kampus aku kalo ikut program magang merdeka sks nya bakal di konversi
positif;rbayuk kecolongan soale kampus merdeka lebih rame daripada ormawa
netral; mau tanya tadi sender ising cek di dikti ternyata udah dua kali ikut program kampus merdeka tapi sender kmrn ikut program aslab fakultas bukan resmi dari kemdikbud dan ga ada konversi sks samsek kira2 kalo sender konsultasi bisa di ajukan buat konversi ke matkul cont 
netral;"Gue kira kampus merdeka itu KKN wkwkwk 
Ya yang penting uda lulus jg "
negatif;cfopper kagaak dah kata prodiku aku semester aku gabisa kampus merdeka lagi jadi magang nyari sendiri  kamu masih kebagian kah kampus merdeka
negatif;Kampus Merdeka Maksudnya tuh kampusnya suka2 dan bebas merdeka menentukan UKT Mahasiswa dan orang tua mahasiswanya ya gak merdeka Sekarang dimana fungsi negara dan aparatus negara kalo begini 
negatif;buset ini awardee kampus merdeka emg bolehin program ini dijadiin ladang duit ye
netral;cm halo guys mau tanya dong yang pernah keterima Kampus Merdeka mau tanya dong buat surat rekomendasi dan SPTJM ditulis kita semester sekarang apa semsster depan ya
positif;masduabiasa aku ikut sib di semester 5 keknya min nya semester 5 klo max nya itu kurang tau tp setauku kampus merdeka cuma bisa 2x ikut  40 sks CMIIW ya soalnya sekarang aku semester 7 mau daftar MSIB lgi wkw lumayan kok asik
netral;cm Guys ada yg pernah lulus program MSIB kampus merdeka mau minta saran kalau anak pendidikan PGSD lebih baik ambil magang atau studi independen Kirakira perusahaan yang open buat jurusan pendidikan apa dan posisinya sebagai apa ya Makasii sebelumnya
netral;unnesmenfess max kamu ikut program Kampus Merdeka itu 2x setelah 2x udah ga bisa lagi
negatif;CM msibmagang kampus merdeka tuh gabisa ya buat smt 7 yg sksnya tinggal skripsian doang sks ga sampe 20 karena di persyaratan ga disebutin atau aku yg kurang teliti cuma disebutin bakal dapet konversi aja
positif;"dibuka nihh

Untuk mendapatkan informasi lebih lanjut mengenai pendaftaran MSIB Angkatan 5 Sobatika bisa langsung mengunjungi website resmi Kampus Merdeka atau kunjungi link ini


Nah tunggu apalagi Sobatika Ayo segera daftarkan dirimu untuk"
positif;"dengan terjun langsung ke dunia kerja sebagai langkah persiapan karier

Dan perlu Sobatika ketahui bahwa salah satu program unggulan dari Kampus Merdeka sedang membuka pendaftaran loh Yaitu pada program Magang dan Studi Independen Bersertifikat MSIB Angkatan 5 sudah"
positif;"Ada informasi terbaru nih buat Sobatika

Kampus Merdeka adalah bagian dari kebijakan Merdeka Belajar oleh Kementerian Pendidikan Kebudayaan Riset dan Teknologi Kemendikbudristek yang memberikan seluruh mahasiswa kesempatan untuk mengasah kemampuan sesuai bakat dan minat"
negatif;Rocky Kampus Merdeka Tapi Rektor Dirantai 
netral;rachelladine collegemenfess lah 2019 kan blm ada kampus merdeka yak
netral;cm kalo daftar dua magang kampus merdeka sama kampus mengajar boleh kah dan kalo diterima dua duanya gimana ya
negatif;dionysuc corndogmosis collegemenfess not sender jg klo di kasusku lbh ke merugikan sih kmrn aku mau ikut project dosen dan pas mau daftarin diri sbg anggota tim kehambat krn dataku di dikti statusnya kampus merdeka tp mungkin bagi yg lain bisa ngerasa itu positif idk ya
netral;cm guys kalo mau daftar kampus merdeka kan ada cek kesehatan ya itu boleh gak sih di klinik2 gitu apa harus puskesmasrumah sakit
negatif;collegemenfess td pagi sempet cek dan 3 smt isinya kampus merdeka padahal gakksamsekk ikut program kampus merdeka apa data w di palsuin kah
netral;gaes ada yang ikut program magang kampus merdeka batch 5 ga atau ada yang udah pernah ikut pengen sharing makasiii
negatif;geloraco Kampus merdeka itu selogan saja tapi realita nya kampus nya terantai
netral;capekhidup1 collegemenfess gapernahh di semester 7 juga cuma kkn aja masa itu kehitung kampus merdeka juga sih
positif;"Lengkap sudah awardees Program Kampus Merdeka Indonesian International Student Mobility Awards IISMA 2023 dari mahasiswa FIB UI 

Semoga prestasi yang diraih dapat menjadi motivasi dan semangat baru untuk terus mengukir prestasi"
positif;Dengan suka cita kami ucapkan selamat kepada para mahasiswa FIB UI yang lolos Program Kampus Merdeka Indonesian International Student Mobility Awards IISMA 2023
positif;"Halo Sahabat Budaya 

BEM FIB UI turut bangga atas perjuangan dari banyaknya mahasiswa FIB UI yang mengikuti Program Kampus Merdeka Indonesian International Student Mobility Awards IISMA 2023"
netral;collegemenfess Kurikulum kampus merdeka maybe
positif;collegemenfess Gue convert kegiatan pengurus organisasi di kampus jadinya Kampus Merdeka di PDDIKTI der Kalo lu ikut ormawa juga coba tanya ketuanya masukin nama gak buat kegiatan MBKM karena kadang ada ketua yg langsung request serentak anggota dimasukin buat nambah nilai
negatif;orenjinemong collegemenfess Samaa nder akuu juga kek gitu Pernah ikut kampus merdeka semester 5 ga tercantum juga
negatif;collegemenfess lah iya aku 3 semester ditulis kampus merdeka padahal pernah ikut 1 semester doang 
positif;wow ga kerasa tiba2 udh dsuruh ngurus buat magang kampus merdeka aja ya
netral;masduabiasa ak bantu ritwit aja yakk soalnya gapaham kampus merdeka mbkm dan sejenisnya barangkali mutual aku ada yg lebih paham
negatif;collegemenfess sama nderr padahal gapernah ikut kampus merdeka samsekk
negatif;Dih barusan ngecek Aku ikut kampus merdeka di smt 4 ga dicantum di dikti 
positif;collegemenfess wkwk aku ikut mbkm pas smt 5 doang tp smt 6nya masih ada matkul yg direkognisi kecantumnya di dikti juga kampus merdeka nder 
netral;Cm aku sekarang msh sem 4 nah kampus merdeka kan smpai 7 juni itu juga aku blom uas ya klo untuk transkip nilai pake yanh sem 3 itu gpp kah atau bagaimana ya rada bingung disini 
positif;pixyyi collegemenfess Iyaa klo datanya salah minta dibetulin sm pihak kampus mu biar bisa ikut kampus merdeka
positif;Mari bersamasama wujudkan citacita Reformasi dari ruang kelas dan selasar kampus kalian masingmasing Mulailah bersamasama mewujudkan pribadi yang Merdeka yang maju yang peka terhadap sekitar yang bisa memerdekakan diri sendiri dan juga mereka yang tertindas
positif;Belakangan ini sedang ramai isu mengenai kolektivisme mahasiswa di era Kampus Merdeka ya memang mahasiswa sudah sepatutnya merdeka dan memerdekakan mereka yang tertindas
negatif;collegemenfess aku ikut kampus merdeka tapi malah ditulisnya aktif
negatif;collegemenfess Kalau sekarang gatau ya nder Tapi tempatku magang tuh full wfh tapi buat yg dari kampus merdeka diwajibkan wfo
netral;Cm guys magang kampus merdeka tuh ada yg wfa kah atau semua wfo
netral;pixyyi collegemenfess Padahal maksimal ikut Kampus Merdeka itu 2x
negatif;collegemenfess aku malah sebaliknya ini padahal semester 6 kemaren aku ikut kampus merdeka  
negatif;collegemenfess barusan cek punyaku malah statusnya aktif semua padahal smt 5 sempat ikut kampus merdeka
netral;orenjinemong collegemenfess kak klo kampus merdeka itu programnya ngapain aja
negatif;lah aku malah kebalikannya aku ikut kampus merdeka tapi statusnya cuma aktif  
positif;Maaf temen2 aku mau nanya nih yang punya pengalaman magang kayak msib kampus merdeka atau yang lainnya Aku sekarang posisi sem 4 saya bisa dikatakan mhs kupu2 meskipun saya di kampus kaya ikut komunitas ngoding gitu dan tugas saya disana sebagai mentor untuk adik2 tingkat
negatif;collegemenfess Aku malah kebalikannya ikut kampus merdeka smt 5 statusnya cuma aktif wkwkwk Tapi temen aku ikut kampus merdeka smt 3 ya statusnya kampus merdeka
negatif;collegemenfess malah kebalikan nder aku smt 6 ikut kampus merdeka tapi ditulis aktif gtu aja
negatif;collegemenfess Aku malah kebalikannya Pernah ikut kampus merdeka tapi di pddikti ga tercantum 
negatif;collegemenfess Aku ikut kampus merdeka 2 kali semester 5 sama semester 6 Tapi di pddikti semester 7 sama 6
positif;collegemenfess beneran gaikut samsek kah soalnya aku cuma ikut KMMI 3 sks juga keitung kampus merdeka btw programnya kan banyak ya siapa tau pernah jg
netral;gada yang ikut kampus merdeka magang apaa 
netral;Anjer pas w cek ternyata status w jg ada yg ikut kampus merdeka 
negatif;bajoeeee collegemenfess jadi semakin banyak mhs ikut kampus merdeka akreditasinya makin bagus atau nurun soalnya kampusku yg smt 7 mau ikutan lagi malah dilarang karna mau fokus memperbaiki akreditasi
negatif;Mana udh pernah kampus merdeka 2x kan jadi gabisa lagi
netral; collegemenfess cm daftar akun kampus merdeka tuh boleh pake email pribadi atau hrs pake email dri kampus ya
netral;cm daftar akun kampus merdeka tuh boleh pake email pribadi atau hrs pake email dri kampus ya
negatif;cm iseng cek nama sendiri di dikti padahal aku ga pernah ikut kampus merdeka tapi di semester 6 statusnya kampus merdeka ada yg sama ga 
netral; yg pernah ikut atau lagi ikut magang kampus merdeka boleh tau tahap seleksinya apa aja
netral;yupi aku daftar akun kampus merdeka kok gini yaa ini gmn solusinya 
positif;"Yaitu pada program Magang dan Studi Independen Bersertifikat MSIB Angkatan 5 sudah dibuka nihh

Untuk mendapatkan informasi lebih lanjut mengenai pendaftaran MSIB Angkatan 5 Sobatika bisa langsung mengunjungi website resmi Kampus Merdeka atau kunjungi link ini"
positif;"dengan terjun langsung ke dunia kerja sebagai langkah persiapan karier

Dan perlu Sobatika ketahui bahwa salah satu program unggulan dari Kampus Merdeka sedang membuka pendaftaran loh"
positif;Kampus merdeka udh mau selese aja wkwkwk bakalan kangen sama bocil bocil kematian ckck
netral;cm sender mo nanya program magang kampus merdeka itu kalo sender masih sem 4 dan bentar lagi udah sem 5 bisa ga sih daftar Soalnya di keterangan minimal sem 5 semua
netral;"statistika ut kenapa kagak ada program magang diluar kampus merdeka sih 

lumayan kan gitu yak nambah nambah pengalaman dan gak yg bakal kagetkaget amat"
positif;Lg rame info tentang kampus merdeka ws Terutama program magang bersertifikat Kampus green screen yg tak terdaftar hanya bsa diam  menonton
netral; utfess di ut itu ada magang diluar ngajuin magang sendiri kaya kampus merdeka
netral;di ut itu ada magang diluar ngajuin magang sendiri kaya kampus merdeka
netral;Kakak2 yg pernah ikut progam studi independent kampus merdeka boleh reply ga saya mau nanya nanya uner
positif;cm msib semester 7 tapi sekalian ngejar skripsi yaynay Kasih saran plis Fyi sender blm pernah nyoba kampus merdeka
netral;mo nanya yg daftar bangkit kampus merdeka itu kan 20 sks ya berarti klo lolos ntar yg smt 5 bakal jalanin 40 sks dong masih bisa idup ga sii  beneran nanya ges sender dari nonit soalnya tia ugmfess
negatif;pengen ikutan kampus merdeka tapi masih sem 4 kenapaaa harus minim sem 5 sihhh
netral;ada yang pernah ikut kampus merdeka mengajar dan bersedia buat aku dm tanya tanya seputar kegiatannya ngga terima kasih  cm
netral;cm besok sender dah semester 7 baiknya udah fokus ke tugas akhir skripsi apa tetep coba ikut kampus merdeka ya rencana mau ikut magang atau gak studi independen Soalnya pengen cepet lulus juga takutnya keteteran gak bisa ngejar waktu lulus 8 smt Saran dong
netral;budak ad nd budak ptk yg pernah ikut msib kampus merdeka trus magang di luar ptk maok tanyak tanyak lahhh
negatif; ditiktok lewat mulu magang merdeka tp kampus gw bukan termasuk kalpus merdeka ajg sebel bgt dh gw
positif;SevensRoad77 Mbahwo999 Miduk17 Kampus merdeka sekarang keren ada partisipasi dari dunia usaha dan dunia industrimelalui praktisi mengajar kedaireka yg nyambungin antara yng punya gagasan dan yang punya duit tinggal SDM nya aja di tingkatkan lagi
positif;lho mas nadiem ga beres justru gua setuju dia meratakan pendidikan 12 thn lho sampe sma dan ngasi program belajar merdeka dan kampus merdeka 
positif;Mbahwo999 Miduk17 Nadim nggak beres gmn Kampus merdeka sama kurrikulum merdekanya bagus kok
netral;11fess kalian ikut kampus merdeka ga tolong kasih saran dong enaknya ikut apa engga sama kasih tau dong plus minusnya thankkssssss
negatif;kenapa yaa uin gak masuk kampus merdeka 
netral;undipmenfess Bukan aku sih nder tapi temenku Itupun pertukaran mahasiswa kampus merdeka Ini yang dimaksud kampus merdeka kan
negatif;uwin kita tu gbs ikutan magang2 yg di kampus merdeka ya 
negatif;"ketik 1 untuk menyerah di kampus merdeka 

1111111111 "
netral;cm guys klo ngga ada pengalaman organisasi masih bisa lulus magang kampus merdeka ngga yaa 
positif;"worksfess Gas ambil 
Aku skripsi sambil program kampus merdeka  part time aja masih bisa 
Tapi kalo gabisa time management gausah nder"
negatif;abis ngobrol dikit sm yg udh smester 6 tentang magang merdeka ktnya dia gagal di interview krn gapunya pengalaman organisasi di kampus tpi dia di luar kampus aktif ky ikut volunteer gtu emangnya pengalaman organisasi di kampus se pengaruh itu ya buat daftar magang 
negatif;HeheNana1019644 collegemenfess Jadi tuh batch sebelumnya kan enggak ada jumlah maksimal ngelamar lowongan di website kampus merdeka nih nah di batch 5 ini dibatesin per orang cuman bisa ngelamar ke 22 lowongan Btw kakak udah search info buat batch 5 belum ya
negatif;"bingung bgt pgn ikutan magang kampus merdeka lg tp semester depan hrs buat proposal akhir
the problem is  bikin proposalnya kelompok berdua2 tp takut keganggu kl sambil magang huft"
netral;sadbichis ddaisyyme collegemenfess Kak izin nanyapas daftar akun di kampus merdeka ada disuruh ngisi rekening BRi dengan ket perlu diisi sedangkan saya ga punya BRIapa itu perlu banget kalau ikut studi independen note ga dapat bbh
netral;cara ganti tempat kelahiran di web kampus merdeka gimana ya ko gabisa diteken
positif;UGMFESS tips lolos administrasi kampus merdeka dong
positif;siyaksha Hehe iya lagi ambil kampus merdeka jadi gabanyak tugas kak Ni sampek srkarang device kakak aja belom ku apus wkwk
netral;Yang punya pengalaman iku program MSIB kampus merdeka bagi infonya donk
positif;"Karier Guru Besar Profesor selama ini jalur Senioritas

Bds Semangat Merdeka Belajar Kampus Merdeka Kemdikbudristek bahkan sudah mengonsep reformasi dg menambah Jalur Paralel dan Konversi

Sebanyak2 pengalaman dosen mau diakui sbg angka kredit
No activities left behind "
netral;ddaisyyme readandstudwths collegemenfess ada tulisannya msib di web kampus merdeka nya
netral; kalian yg ikut program kampus merdeka matkul metode penelitian bisa dikonversi ga
netral;UTmenfess magang mandiri or magang dari kampus merdeka
netral;UTmenfess kalo buat program kampus merdeka bisa minta ke fakultas nder kalo fhisip bisa via email
negatif;collegemenfess ada yang tau rekomendasi perusahaan yang open nagang di surabaya kok cek di web kampus merdeka cuma ada lokasi jakarta ya hmmm
netral;telyufess kamu mau ikut mbkm atau magang mandiri yg wajib dari kampus nder kalau mau liat yg kerjasama kampus merdeka tinggal liat pas mbkm buka pendaftaran aja
netral;ahyeonreeves collegemenfess aku sptjm sama sr yg ttd dekan trus ada formatnya juga cma aku lupa format sr dikeluarin dri pihak kampus merdeka atau kampus
netral;cm mau tanyaa kalau program pertukaran mahasiswa merdeka itu kampus yang di pulau jawa bisa pilih yg satu pulau atau harus selain jawa ya
negatif;lupa mau war coldplay karena panik kampus merdeka
netral;Telyu Halo abgkk ilmu komunikasi aku masih belum terlalu paham mengenai magang kalo magang untuk perusahaannya sendiri kita bisa ambil perusahaan dimana aja kah Kalo iya ada daftar list perusahaan yg kerjasama sama kampus merdeka ga ya Aku masih bingung bgt mohon cont
netral;utfess maaf oot ada yg udh pernah ikut kampus merdeka boleh aku tanya ga aku kurang paham baca sndiri
netral;UT Bentar lg kan program magang merdeka dibuka kalian bakal ikutan ga Terus utk kampus UT bakal keliatan ga ya sama company yg lain
netral;cm gaiss kalian yg sempat urus sr sma sptjm buat program kampus merdeka itu gmn ya ngurusnya Ke akademik kan Trs bilang apa Lama ga ngurusnya
netral;Baru mau daftar akun kampus merdeka boleh pake email dari kampus gak ya Atau harus email pribadi imissu
positif;" SOSIALISASI PROGRAM BANGKIT PADA TINGKAT PERGURUAN TINGGI VOKASI 

Hallo Akuntansi 

Apa itu Bangkit 
Bangkit adalah salah satu program Studi Independen Bersertifikat Kampus Merdeka

Direktorat Jenderal Pendidikan Tinggi Ditjen Dikti bersama Google GoTo dan Traveloka"
negatif;lelah dengan mbkm yang ga merdekamerdeka banget di kampus saya
netral;gongtangcoty Ak kampus merdeka
positif;Bismillah ya Allah aku ingin kembali quote tweet ini saat aku diterima magang msib kampus merdeka di Jakarta nanti Allahumma sholli alaa sayyidina Muhammad  wa alaa ali muhammad
netral;worksfess bisa pengalaman PKL di SMK magang kampus magang merdeka atau apapun magang dan berapa lama pun waktu magangnya bisa dicantumkan di CV ya
netral;Cm guys sender mau coba lagi magang merdeka terus ini sr sama sptjmnya harus minta yang baru ke kampus lagi apa yang kemarin buat angkatan 4 juga bisa 
netral;Muhamad140704 sbmptnfess sorry oot  mending masuk kampus islam swasta yg medioker atau masuk uin ya bro apalagi dealbreaker masuk uin itu katanya gabisa ikut program kampus merdeka iismamsibpmm dll so wdyt
netral;HELP akun email kampus aku ga bisa log in Gitu mulu tiap mau tambah akun tolong gimana Trs daftar kampus merdeka pake akun email kampus atau pribadi CM 
positif;"INFO MAGANG ALUR PENGAJUAN TANDA TANGAN UNTUK SR DAN SPTJM KAMPUS MENGAJAR 2023

Hallo KMFEB

Merdeka Belajar Kampus Mereka MBKM sudah membuka pendaftaran nihh 

Pendaftaran dapat diakses melalui link berikut
 "
netral;"Program Kampus Merdeka Untirta dan Rumah Dunia di Yayasan AlAlawiyah Kota Serang  

kampusmerdeka 
untirtaserang 
yayasanalalawiyah 
rumahdunia 
golagongkreatif"
positif;"INFO MAGANG  ALUR PENGAJUAN TANDA TANGAN UNTUK SR DAN SPTJM KAMPUS MENGAJAR 2023 

Hallo Warga IESP

Kami dari bidang advokasi ingin menginformasikan bahwa Merdeka Belajar Kampus Merdeka MBKM sudah membuka pendaftaran nih "
netral;cm program kampus merdeka yg bisa diikutin mahasiswa semester 3 apa aja ya
netral;Ugmfess daftar akun magang merdeka pake email kampus
netral;askihuy convomf halooo dulu aku sama temen aku langsung kirim proposal magang sama cv ke humas ANRI tapi gatau sekarang sistemnya kaya gimana Kalau ga salah sekarang harus ikut sama kampus merdeka
netral;collegemenfess Aku kaa tapi bukan magang kampus merdeka gapapakah Magang pribadi soalnya hehe
positif;worksfess Sekarang sih lebih ke kampus merdeka biasanya yg ikutan program kampus merdeka bisa lebih cepat kerja
positif;dumbbassz itu program kampus merdeka kalo keterima mayan 20sks ga masuk kalo engga bebas pkl mehehe
netral;cm gaess aku kan mau daftar magang merdeka tp disuruh isi ini berkas ini minta ke kampus ato kesiapa ya 
positif;OposisiCerdas Dia menafikan revolusi pendidikan yg dibuat oleh mas mentri nadiem mulai dari tingkat SD sampe perguruan tinggi dg kampus merdeka nya begitu juga dg pendidiknya kualitasnya jauh  anies cuma menang di narasinya sementara nadiem gak banyak bicara tapi diapresiasi para guru besar
positif;Rahmickey Btw adikku sekarang lagi ikutan program Kampus Merdeka Semoga adikku dan timnya bisa jadi good intern
negatif;Kampus merdeka tapi pemilihan rektor ga merdeka Penak turu wae ngasi 7 tahun 
netral;Program kampus merdeka yg bisa wfh apaan yak
positif;being a part of Kampus Merdeka i think its cool 
positif;"sahabatbawaslu Rabu 17 Mei 2023 Bawaslu Menerima Kunjungan Monitoring Mahasiswa Magang UMRAH Program  Magang Kampus Merdeka di kantor Bawaslu Kabupaten Lingga

Ayo awasi bersama SahabatBawaslu AyoAwasiBersama PemiluSerentak2024 "
negatif;ikut kampus merdeka ga ya tapi asli gue males banget jadi guru begitu anjg
negatif;Sertif Magang Kampus Merdeka w di hape lama jir  nyari di email2 kok gada dah perasaan dulu dikirim lewat email
netral;UPI mau nanya tentang SPTJM Kampus Merdeka untuk MSIB ada yang tau
positif;polbanfess sekarang akses buat kampus merdeka  iisma ga sulit lagiii menarikkk
netral;utfess Ada ikut kampus merdeka atau pas PPB
positif;"Selamat untuk Ira Barqi dan Yoga Semangat mensosialisasikan dan berdedikasi serta berkontribusi dalam kegiatan ataupun program kampus merdeka

Semoga dapat memotivasi SobatBahari untuk terus berkarya semangat menuntut ilmu dan meraih prestasi di semua bidang

KKPThrive"
positif;collegemenfess pmm itu pertukaran mahasiswa merdeka program dari kampus merdeka semua bisa ikut ga harus yg dapet beasiswa aja nder
netral;utfess Ada nanti pas PPB atau ikut kampus merdeka
positif;UGMFESS web sama instagram sii pantau terus karena bakal di share di sosmed kampus merdeka
negatif;ainalev worksfess kampus merdeka cuma bisa buat S1 ya kak
positif;Akakasaks see u di s2 atau kampus merdeka kalo ada
netral;mitra kampus merdeka 
negatif;KampusMerdekaRI dari pada di it ngurusin pendaftaran MSIB batch 5 MENDING URUSIN DULU DEH BBH BATCH 4 YG BLM CAIR SAMPE SEKARANG KemdikbudRI nadiemmakarim TOLONG DI TINJAU KEMBALI PROGRAM KAMPUS MERDEKA YG SATU INI Namanya aja kampus merdeka TAPI GA KELAKUANNYA GITU
positif;gw iseng ketemu ini di ig langsung ngakak wkwk sumpah program magang kampus merdeka tuh buagus emang soalnya kalian kelar kuliah udah ada pengalaman kerja buat dimasukin cv 
negatif;armandhani Ya Allaah Exactly my struggle for the past 5 months with my interns from Kampus Merdeka Kemendikbud program  lack of initiative very weak skill of communication and the attitude I have so much to say abt their attitude 
netral;Ngerasain juga secara langsung waktu jadi pembimbing mahasiswa kampus merdeka magang di kantor ku kemarin  
netral;pls gw mau nnya magang kampus merdeka udh buka lagi yh apa gmana dah
netral;collegemenfess tanya ke perusahaannya nderr kalo ga ya ikut msib di kampus merdeka
positif;UTS udah kelar saatnya lanjut fokus ke birokrasi puyeng wish me luck minat join program kampus merdeka
positif;"Pemaparan materi oleh Kepala Program Kampus Mengajar dan Pertukaran Mahasiswa Merdeka

Jangan lupa hadir yaa
See u



Departemen Pendidikan
HMJA PNJ 20222023
Kabinet Gradasi
Gemakan Perjuangan Wujudkan Kebermanfaatan"
netral;cm surat sptjm untuk daftar kampus merdeka perlu di cap prodi gak ya
positif;Program MSIB yang diusung pemerintah ini sangat bermanfaat bagi mahasiswa 
netral; karirfess kr HR HR tuh pada ngeh sama magang magang bergengsi kayak kampus merdeka atau magenta fhci bumn gak ya
positif;"21 lulusan Program Profesi Ners Fakultas Keperawatan univriau dikukuhkan
"
netral;kr HR HR tuh pada ngeh sama magang magang bergengsi kayak kampus merdeka atau magenta fhci bumn gak ya
netral;cm ada yg pernah buat akun kampus merdeka kalau datanya di kampus merdeka peserta didik baru itu ngaruh ga ya ke nantinya mau daftar magang merdeka atau studi independen
positif;"SURVEI PELAKSANAAN MBKM UGM 2023

Apakah Kamu tengah melaksanakan Program Merdeka Belajar Kampus Merdeka MBKM 

Kementerian Pengembangan Potensi dan Karier berkolaborasi dengan Kementerian Advokasi dan Kesejahteraan Mahasiswa BEM KM UGM 2023 tengah melaksanakan Survei"
negatif;cm mau nanya dong guys tadi waktu aku isi profil akun kampus merdeka itu ada bagian suruh ngelengkapin rekening bank itu kan nah tapi keterangannya harus BRI atau BSI sedangkan aku gapunya rekening dari salah satu bank itu berarti wajib bikin rekening lagi dong yaa cont 
positif;Prof Fathur menyampaikan untuk membangun kapasitas UNNES sebagai Kampus Merdeka berkarakter mulia dan Universitas Berkelas Dunia dibutuhkan dukungan dari berbagai pihak yang kompeten dan relevan AllinPrabowo IkutPakde Prabowo Subianto
