Sentimen;Text
netral;kimyeonmark jgn gitu dia dapet nilai 55 mbkm makanya aku ketawanya tailan
negatif;"Nyoba daftar mbkm di perusahaan yg sama disaat gw sebenarnya bisa apply di company yg lebih gede even magang di DPR cuman gw nyari aman waktu itu

Such a fool option karena itu worst pengalaman meet a worst mentor juga "
negatif;ourgeminixx LAH YA ITUUU MBKM itukan nuker sks matkul nah matkul pemgantar akuntasi biaya gabisa dituker
netral;doyoungforlife MENDING YANG BISA DITUKER SIH biar ga kerja dua kali napa g join mbkm ajh siee
netral;UPI guys ada yang punya file sk mbkm ga ya
positif;uf MBKM khas unpar kaya ekologi bela negara dll ada lagi gasi semester depan ingin ikutan
negatif;fak tugas akhir magang mbkm kenapa banyak bgt
netral;ugmfess koor pt msib mbkm tauu dari mana deh urgent nih
netral;Healing berkedok MBKM meski stres dikit 
netral;"2 IPSAGRI
IPSAGRI ini program mbkm mahasiswa pertukaran pelajar aku dapat info dari dosen kemudian aku ikut mata kuliah Manajemen Pengushaan Perkebunan dari Universitas Jember Next aku lanjut cerita setelah transkip nya keluar wkwk"
positif;Setelah penantian yang serba mendadak bismillah MBKM ke salah satu perusahaan tambang besar di Kalimantan Thanks God Wait for me Borneo 
positif;ygdisakitin InfoDikti Halo InsanDikti  pendaftaran MBKM dapat dilakukan oleh Mahasiswa yang berada di semester 35 dan 7
netral;Tbl tbl buat akun mbkm diminta nyantumin username twitter 
netral;rl maaf ada yang tau kapan magang mbkm tutup 
netral;cm Guys mau tanya kalo lolos PMM3 trus mengundurkan diri tapi belum klik konfirmasi apa bakal berpengaruh di program mbkm lainnya kayak kita jadi gabisa ikut program mbkm lainnya gitu thanku
netral;ditjendikti halo saya mau tanya untuk MBKM magang merdeka apakah bisa mengubah surat SPTJM dan SR karena lupa cap untuk SR saja
positif;"Informasi untuk mahasiswa yang mau ikut MSIB terutama Magang Bersertifikat Kampus Merdeka MBKM 

1 Download SPTJM terbaru 
2 Isi SPTJM  print  beri materai  scan  kirim email ke kampus dan minta tanda tangan 

 bookmark  "
netral;ikut magang mbkm yay or nay
positif;"InfoMTK

Ikuti Sosialisasi MBKM Jurusan Matematika hari ini khusus untuk mahasiswa angkatan tahun 2020  jangan sampai ketinggalan informasinya yaa

ubbhebatt
ftubb
matematikaubb "
positif;Yeay Unhas peroleh penghargaan terbaik MBKM Kategori PraktisiMengajar oleh Kemendikbudristek pada peringatan Hari Pendidikan Nasional  
negatif;"kegblgnunfaedh Wah gilak jago bgt itu skill nguntitnya hrs dicari tuh keknya udh banyak makan korban Kek sistim MBKM udh bikin mahasiswa pada bingung
"
netral;asteroits lu kknnya ada mbkm ga
netral;stuckwithyul Silakan melakukan pengecekan data mahasiswa di PDDikti apakah NIK sudah diinput ke data PDDikti atau belum karena data yang ada di akun MBKM merupakan sinkronisasi dengan data PDDikti
netral;umfess PLP wajib biasanya dikonversi lewat MBKM atau AM
netral;disni ada kaka kaka fh yg perna ikut mbkm ga yaa aku bole tanya2 makasiiii braw
netral;collegemenfess di semester 7 tinggal berapa SKS nya nder asal blm lulus ga masalah sih enak di kejar di smst 56 nder kalo mbkm
netral;cm guys join MBKM di semester 7 itu membantu banget dalam pengerjaan skripsi gasi
netral;cm haloo mau nanyaa untuk yang ikutpernah ikut pmm matkul yang ditawarkan di web pmm sama web mbkm kampus penerima emang bisa beda gitu ya Soalnya matkul yang mau aku ambil di PT Penerima gaada gitu padahal di web pmm ada itu kirakira bisa di komplain ngga ya cont
netral;ugmfess program bangkit nya mbkm itu kegiatannya online atau offline
negatif;"Merdeka apanya Dosennya pada takut ngomong dan mahasiswanya takut menjadi aktivis
"
negatif;PRakeyan Klau itu aku gatau ya kak tapi katanya klau kmu ikut program mbkm bakal susah lolos lagi
netral;mau tanya unila yang ikut MAGANG MSIB MBKM posisi di BUMN emang masih kosong ya makasih bro
positif;bangkittt plsss adaiin kegiatan tapi jangan mbkm dongggg plss plss plssss
negatif;aku lebih memilih ikut gigih karena bisa untuk public fresgrad final year and lulusan vocational stud ga terikat MBKM ga terikat birokrasi kampus yang menyebalkan 
positif;lagu yang tiap hari kudengerin jaman mbkm th lalu heheh
netral;"Todays agenda
 UAS 
 ttd pa mbkm byoc
 nyicil ddrb
 nesp biglob
 abk 
 laundry"
positif;fnampov bismillah mbkm keterima di rans wml
netral;"Mikir gasih gimana nanti kerja trus lepas dr ortu 
Ini ngurus mbkm aja administrasi dll dah up n down awkwkek"
netral;punten adakah temanteman disini atau abangkakak yang bersedia ditanya2 mengenai mbkm dan msib
positif;gw BERSYUKUR BGT ternyata intern mbkm ada 12 orang ga cuma gw doang takutnya ntar jd tolol sendiri diantara profesional kn malu2in anjim
positif;unnesmenfess ikut mbkm aja auto A tapi ttp harus ngumpulin produk sih
negatif;JefandraL Tau gk sih om gue kan mau daftar mbkm kan trs pas gue mau ambil transkrip nilai gue nunggu kaprodi lama bgt krn Lg rapat sampe jam 3 trs pas h1 close pendaftaran gue baru sadar klo ternyata transkrip nilai tuh ada ttd dekan alhasil transkrip gue Gk ada ttd dekannya 
negatif;ko gue ga inget apa2 ya smt 4 sama 5 ikut mbkm apaan iseng cek pddikti buat liat status mhs trs baru ngeh smt 4 sama 5 statusnya mbkm kyk perasaan gue kg ngapa ngapain dah ok saatnya baca doa lupa 
negatif;Dahlah ini mah aku fix gk lolos seleksi berkas di program magang Kemendikbud dibuat galau lagi oleh MBKM 
negatif;pusing bgt ngerjain luaran mbkm
negatif;tyunningss Iya kan na waktu itu aku sempet ikut program mbkm kampus mengajar Disitu aku bener2 capek fisik sama mental capek banget Sampe asma aku kambuh terus sering drop Aku ga bisa bayangin kalo harus jadi guru ngajar dari pagi sampe sore Yg ada gaji abis buat beli obat 
negatif;ubsansfess Jadii opsional doang tp tetep diganti tahun dpn but ga wajib mmd bisa mbkm magang mandiri or mmd Klo ngundurin mah udah gabisaa krn udh terdaftar di asuransi kesehatannya gt klo gslh  Kebetulan tmn ku yg maju ke wadek kemarin
netral;"kegblgnunfaedh Alan walker humble bgt orgnya pasti ngampus di indo dgn sistem MBKM
"
positif;DeimosLordSeven collegemenfess Program mbkm bagus lho
netral;UPIfess kayanya gak bakalan telat lulus nder tapi mending beresin dulu matkul wajibnya biar tenang ikut MBKM nya atau coba konsultasi sama dosen PA soalnya kadang beda prodi beda kebijakan cmiiw
netral;bingung bangett daftar mbkm lagi ga yaaa
negatif;stdyme scobiedobie collegemenfess mbkm dulu punyaku gabisa kak
negatif;MBKM fakultas lain dapet duit meanwhile fapet  
netral;Markussiteladan taunya nanti MBKM ketemu spss lagi 
netral;gue bersedia magang dimana aja gaji kecil atau gede tapi gue ga tau magang pendidikan tuh selain mbkm dimanaaa
negatif;"MasUchiha MBKM

Maraknya Budaya Korupsi Mendikbud

"
netral;mengambil kuliah ataupun kegiatan di luar program studi Fakultas Ekonomi dan Bisnis Universitas Brawijaya FEB UB termasuk salah satu yang mengimplementasikan kebijakan tersebut Salah satu program MBKM yang ditawarkan ialah Magang dan Studi Independen Bersertifikat MSIB
negatif;Siapa yang laporan MBKM nya udah kayak skripsi Saya HAHAHA
negatif;UPIfess ipk gw 285 smster5 dan gw menyesal karna gabisa ikut mbkm sedikit gambaran aja bang
negatif;tanyakanrl blm lagi kalo ada beberapa mk konversi yg mengharuskan kita ngerjain project atau tugas tambahan huehue gw pernah ikut mbkm dan ternyata tiap mk yang dikonversi itu masih ada tugasnya lagi jadi selain ngejalanin kampus merdeka di luar kita juga ngerjain tugas dari dosen cuapek
negatif;Indonesia timur nampaknya perlu diperhatikan lagi soal penerapan MBKM ini krn fasilitas dan akses yg masih terbatas Mendikbud Nadiem hrs melihat ini sbg persoalan serius Faktanya kalo sistem sebesar ini gagal bbrp generasi akan tumpul dimasa depan 
negatif;Sistim Kampus Merdeka pernah dikritisi mahasiswa langsung lewat RDPU Komisi X yg didalamnya ada kamus UGM UI dan Universitas Kutai Kartanegara dll Kritiknya soal akses yang diberi pada kemitraan tidak akan adil serta di Univ Kutai sendiri MBKM sangat diragukan Penerapannya 
netral;Mahasiswa KKD MBKM UMGO Gelar Pemeriksaan Kesehatan Gratis di Desa Torosiaje Jaya Kabupaten Pohuwato  Gorontalo Dalam Rangka melaksanakan tugas Kuliah Kerja Dakwah KKD terintegrasi dengan Merdeka Belajar Kampus Merdeka MBKM
positif;collegemenfess Ikut magang MBKM gih nderrr kyaknya msh buka
netral;UPIfess Nggak kurikulum anak 2021 udah setting untuk beres semua matkul semester 15 baru deh 67 nya bisa MBKM
positif;"Kolaborasi Mahasiswa KKN MBKM UHO dan Pemdes Tapulaga Tanam Manggrove
"
netral;"collegemenfess Setahuku MBKM MSIB Magang nanti ada transportasi keberangkatan 

"
netral;cm kalo magang mbkm ditempatin di luar pulau itu nanti transportasinya biaya sendiri atau ditanggung instansi ya makasi sebelumnya
netral;collegemenfess Kalo daftar semua bisa nder tapi kalo nanti lulus harus milih satu kegiatan ajaa kalo mau cari info mbkm masuk grup telenya aja nder
netral;ini maksimal bisa daftar apa aja ada yg tau misal mau daftar kamjar trs daftar si sama magang juga cari2 info ttg mbkm dimana ya thxx cm
netral;tanyakanrl sibukin diri untuk halhal yg bermanfaat nderr Contohnya kalo dulu sampe dititik ngajuin jadi calon wakil hima join aslab ambil full sks  praktikum dan ikut mbkm Lebih works lagi kalau dapet support system yg baru
netral;ilIicitrings IYAA UDAH LDRAN TERNYATA tapi sekarang kan dia mbkm jadi di tempat asalnya nah sering post dah tuh sama pacarnya
negatif;kalo ditanya kenapa sekarang keknya organisasi keknya agak susah buat kaderisasi atau kepanitaan kurang minat selain jawaban karena ada mbkm magang² yg lain dan kesempatan lain sebenernyaa tu se simpel emang di organisasikepanitiaan dapet apasi karena yahh klo dijawab bakal
positif;"Halo TemanMamin 

Pendaftaran Program Merdeka Belajar Kampus Merdeka MBKM Universitas Bangka Belitung tahun 2023 telah dibuka 

Catat tanggalnya jangan sampai terlewatkan ya gess 

manajemenkereneexcellence "
negatif;tanyakanrl Kan konsep MBKM output nya akan begini Catat dia hanya lulus smua MK praktikum selebihnya harus kuliah Toh skrg sdh bisa juga lulus tanpa skripsi yg penting nulis artikel ilmiah tentu sesuai kebijakan kampus Ini protes adl ungkpn hati mhs minder yg gk lulus² sih hehe
positif;salrendipity Ngga ngerti sistem pendidikan kita yang  bikin Dengan skema MBKM itu wajar aja kok asal prodinya mau bisa dibikin blok transfer up to 40 sks kalu gak salah
negatif;"Paling sedih ketika MBKM 1bln ini cerita singkatnya yaitu ada pemeriksaan n screening catin n hasil labnya si pria adalah thalasemia 8 koma brp gt n normalnya 10

Pd dasarnya gen yg membawa talasemia lebih dianjurkan u menghindari menikah  "
netral;cm ada anak univ Malikussaleh unimal ga ya disini Aku mau nanya ni Adikku pengen daftar kegiatan mbkm magang studi independen dll nah itu daftarnya dari website mana ya biar bisa tau daftar mitra yg bisa dituju Makasiii ^°^
netral;bingung mau pilih mbkm apa kuliah biasa 
netral;Nangis bgt bulan lalu ikut kegiatan MBKM di salah satu desa dan kita ke SD juga di situ aku masuk di kelas 3 Ada satu anak cowo yang dibully sama temen2nya dan mereka ngebully terang2an di depan ku 
netral;cm di sini ada yang daftar mbkm kampus mengajar tapi domisilinya di luar jakarta ga mau tanyatanya
negatif;gweh udh hopeless bgt sama mbkm
netral;stamvps kak mjb aku bole nanya² seputar berkas mbkm ini gaa
negatif;caratstalk mahasiswa dikejar mbkm kkn dan skripsi yang bersiap menjadi sandwich gen saat amin dapat kerja nanti
negatif;"Lihat soal soal UAS kesel banget yah
Kaya anjir kaga ngerti apa apa Ini ko bisa gini ini ko gitu ngerjain nya kaya gimana anjrit Nasip MBKM tetep ikut kuliah cuman untuk UTS sama UAS tapi kaga tau materi "
negatif;Lagian si itu aja cuma bebas magang doang karena itu bagian dari mbkm tapi si itu juga wajib ngerjain skripsi
negatif;gw mbkm di jakarta ntr biar deket sm lu 
netral;Ugmfess anak geo ada yang rencana ikut magang mbkm nga
positif;tanyakanrl Sirik aja Dia kan sesuai dgn jurusannya dan sesuai dgn visi misi MBKM Dia secara praktik sdh membuktikan apalagi secara teori Fair2 aja kl memang kebijakan kampus bisa langsung lulus 5 bulan di karantina aja udah berasa ujian tiap Minggu Ygsirik silahkan ikuti jejaknya aja
netral;guyss ada yang magang merdeka  msib mbkm di jaklingko gaa Udah bisa klik Daftar atau blm
negatif;mbkm nyebelin anjir giliran pengen ngelab kerja labnya dikit bgt 
netral;bye mbkm
netral;"5 Semester 6 S1 ikut MBKM yg casenya gk terlalu berat  sambil ambil matkul S2
6 Semester 7S1  2 S2 fokus skripsi untuk S1  sambil kuliah S2 
7 Lulus S1  lanjut S2 tinggal 1 thn lgi  ikut pelatihan dan seminar atau ambil magang"
netral;"I wish dlu gw berpikir seperti ini  

1 Ambil program Fast track  S1S2  cuma 5 tahun
2 Semester 12 S1 ikut organisasi
3 Semester 34 S1 perbanyak daftar seminar  pelatihan
4 Semester 5 S1 ikut MBKM Magang  jadi gk perlu magang lagi  nilai semua di konversi"
positif;collegemenfess Aku sem 7 ikut mbkm dan sangat worth it Klo semsster 8 masih boleh ikut mau lg tp sayangnya udh gabisa wkw
negatif;khawatir kkn tu ya pas seleksi mbkm nya
netral;collegemenfess nay sem 5 saatnya mulai cari info maganginternship ato ikut mbkm nya
netral;Cm pengumuman pkm thun ini lama bener yeegue kan ada inceran mbkm juga tpi ketahan pkm
negatif;Pusing bgt gila sama laporan mbkm mana sisa 2 minggu lagi
netral;kuncibiru7 UPIfess Aku emang lagi MBKM sih sekarang Tapi sependengaran aku katanya baik MBKMga KKN 2 sks tuh udah ga wajib Karena katanya ada KKN Kebangsaan yang 20 sks itu Apa gmn sih kebijakannya sebenernya
netral;cm magang mbkm mandiri sama pusat itu prosedur nya sama atau ga ya
positif;nanya pendapat dooong ikut magang mandiri di instansi sama ikut program MBKM magang merdekastudiindependen di semester 7 gitu boleh ngga yaaa kuat ngga yaa kira2
netral;chesarawrr UPIfess km prodi apa setauku kkn masi matkul wajib sih utk rekognisi itu buat yg konversi msibmbkm krna nnti didalemnya ada upload terkait hal2 msibmbkm mungkin bisa dikonsul ke prodi yaa
netral;"icuspencintajkt Puji Tuhan klo betah sih kak
Jadi ga stres2 amat ngejalanin MBKM yang aku ga tau itu se ngeri apa"
netral;dkarmast illsshine IISMAfess Ehh hrsnya bisa kok Jd sblm iisma itu paling MAX ikut 1 kegiatan MBKM
netral;convomf Jabatan km di angkatan ketua wakil sekre bendahara koor matkul project jurusan project kkn mbkm magang
netral;Rilll jd keinget caper ke ex crush pas lolos mbkm sm pkm  
positif;abis daftar MBKM hehehe semoga lolos aamiinnnn 
negatif;gue benci pio bgt bgt gue dah cape mbkm dr smt 4 biar smt 67 nya enak malah sama aj KSL
netral;unj halo kakak kakak yg pernah ikut mbkm alur konversi sks di unj tuh gimana ya tolong spill dong ka sekalian tips nya  tia
positif;and the end gua memilih utk ga ikut dlu mbkm semester ini krna w msih dibanjiri proker organisasi w yg membludak dann sangatt besar smoga semester depan w dftr dan w keterima AMIN
negatif;mbkm mbkm tai kucing
negatif;mbkm taek
netral;UPIfess mau tanya dong kalo misal udh ngambil MBKM di semester 6 kan kemaren harus KKN lagi
positif;"Mahasiswa FEBI IAIN Ternate tampak siaga menjaga standstand mereka sepanjang berlangsungnya Expo fakultas ekonomi dan bisnis Islam FEBI Jumat 262023
kemenag pendis ptkin mbkm expo mahasiswa iainternate pameran kreatif bentengoranjeternate ternate malukuutara "
netral;"Lomba kedua pelaksanaan Expo Fakultas Ekonomi dan Bisnis Islam FEBI IAIN Ternate di halaman Benteng Oranje Ternate Jumat 262023
kemenag pendis ptkin mbkm expo mahasiswa iainternate pameran kreatif bentengoranje ternate "
negatif;collegemenfess kalo seumpama masih semt 5 6 menurutku masih worth it kalo 7 engga soalnya kalo di fakultasku smt 7 dah disuruh nyicil skripsi dan kalo bisa dah sampe sidang kalo seumpama smt 7 masih mbkm dan baru nyicil skripsi di smt 8takutnya nanti malah nambah semester
positif;"Pendaftaran program Kampus Mengajar dan MSIB masih dibuka alumni MBKM Unmul bagikan pengalamannya Apa saja persyaratan dan manfaatnya

Simak 

LPM Sketsa Unmul 
Semangat Berbagi dan Menginspirasi

BeritaKampus SketsaUnmul"
negatif;nejiare oalah whshshs onu kemaren waktu mbkm bun sebulan penuh
positif;UNYmfs awal² emg rada² gmn setaun kenal jd akrab semua Malah skrg banyak tmn dari fakultas lain grgr mbkm
netral;ingin ikut mbkm tapi tidak mau mengganggu sempro 
negatif;collegemenfess Eranya sudah beda MBKM banyak banget pilihan bahkan ga ikut organisasi pun bisa sibuk tar giliran ikut organisasi giliran kating ambil MBKM juga jadi kosong sekrenya karena sebagian besar join magang riset dll event event dikerjain yang baru masuk semua
positif;cribabyxoxo eh yg mbkm nya udah bisa di ambil dr smt 4
negatif;2 Misscom kampus dan pihak MBKM menyebabkan mahasiswa tidak bisa konversi nilai sehingga dari aku sendiri mendapatkan 36 sks Pada saat itu kadang nyalain laptop hp sama pinjem hp yang artinya 3 kelas secara bersamaan dengan kampus yang berbeda
positif;beruntung bgt Maba yg bisa ambil mbkm
positif;liyuzausman UGMFESS Persiapan KKN makalah seminar laporan MBKM Rapopo Mas Lakoni alonalon penting hari H beres ra ono masalah
positif;sextratime collegemenfess ikut mbkm aja ini mah
positif;HUFT MANGAT RIMA AYO DIKIT LAGI TINGGAL BUAT PPT MBKM TERUS FINISHING PROPO SKRIPSI TERUS BUAT PPTNYA JUGA TERAKHIR URUS DAFTAR SISTEM THESIS
netral;collegemenfess Pengen tapi jatah kampus merdekaku dah abis anjrittt Apa gabisa ya intern eksternal tanpa melalui mbkm
positif;Seleksi iisma menurut ku seleksi yang paling susah drpd program mbkm yang lainn kyk magang pmm dsb Bener2 effort bgt buat daftar iisma tuhh
positif;" codingfess code Serbaserbi MAGANG di program MSIB MBKM 
Ceritain pengalaman kalian yang pernah ikutan magang di program ini guys"
netral;kapan sih ini urusan mbkm bangun tidur kelar
negatif;Harusnya seorang sarjana dalam pembuatan laporan harus real data lapan dan ilmu yang diterima di kuliahan bukan cuma sekadar sop dan kopetnsi yang didapat dari kegiatan mbkm dih
netral;uny gais adakah anak sasing pengen minta jadwal uas sasing dong aku ikut mbkm sasing tapi jadwal uasnya belum dishare sama dosennya  makasihhh
negatif;Cape cape bikin laporan mbkm yang full data dari kandang lengkap plus ikutin semua kegiatan biar datanya ga ilang ehh ternyata laporannya cuma gitu aja
netral;Kasta tertinggi di program mbkm tu IISMA ya
positif;gajian mbkm gue beli album
positif;"kamu bisa ikut Sosialisasi Magang MBKM D3 FEB Unsoed pada 
 Hari  Tanggal  Rabu  07 Juni 2023
 Waktu  1300 WIB  selesai
Lokasi  Lantai 6 Lab Terpadu FEB Unsoed

Narasumber
1 Dr Lusi Suwandari SE   Dosen FEB Unsoed"
netral;4 tahun kuliah jdi sarjana mbkm
negatif; ini kalau ngasih pengaduan gitu kesiapa ya please tolong banget dipercepat kkn nya soalnya pengen ikut magang merdeka mulainya awal agustus takut bentrok sama kkn kesiapa ya kasih pengaduan ke rektorat gitu bisa g sihsoalnya kesempatan terakhir ikut mbkm
negatif;"ubsansfess br diinfo bikin laporan kkn h2 penutupan sidang nyambi tbtb info hrs ikut uas pdhl 1 smt gamasuk kls krn mbkm nyambi laporan kampus mengajar nyambi les toefl nyambi tes toeflnya nyambi bikin project yg anggotanya ilang semua semua dalam seminggu lewat ga 

lewat nder"
negatif;NGEBUT BGT SKRIPSI W YAGUSTI BELOM TUGAS MBKM
netral;"mentemen mutual ada yang pernah ikut magang mbkm ga yaa
yang pernah ikut tolong arahan nya dongg
Bingung bgttt "
netral;umfess Gapapa aku dulu dapat D ngulang dehh atau kalau skrng bisa di konversi ke mata kuliah mbkm
negatif;Daftarr mbkm susahh gaa Pengenn bangett buat magang di mbkm
negatif;prodi mbkm fib ngancurin jam tangan acara buruk revisi ta cekcok pacaran dalam seminggu ini bikin ngebatin bgt
negatif;illsshine IISMAfess Setahuku gabisa karena salah satu syarat daftar iisma belum pernah mengikuti program mbkm
positif;"ubsansfess 

ini buat group nyaa ya gais bukan scam kok pure untuk project mbkm makasih banyak yang sudah joiinn"
netral;Sumpah ya isi fyp gw semuanya pada bahas cv buat msibmbkm kalo engga lolos pmm Keknya gw emg dah di suruh buat cari pengalaman utk ngisi cv deh
negatif;koiso ulya ngomong kalian mbkm ke fasilkom aja kalkulus full ngang ngong ngene kok yo
negatif;Jd gimna nih yg mau lulus 35 tahun Sksksksksk sem7 aja baru milih peminatan dasar mbkm aneh 
negatif;Kuliah berat bgini curiga keterima magang mbkm di Freeport klo ga di UT
negatif;"11Fess disuruh ikut MBKM tapi pas ngurus SPTJM luamaaaa bgt udah 1 minggu gak terbit

Now playing Aruma  Muak"
netral;ditjendikti hi admin permisi izin bertanya apakah dengan 2x MBKM kita bisa memilih di program yg mana kita bisa konversi SKS Contohnya di smt 5 ini saya pgn ikut stupen lalu di smt 6 IISMA Skema belajar program Stupen saya bisa online jadi masih bisa ikut perkuliahan min
positif; girlsbeyondid Kalau kalian ngincer company kayak Lazada Telkom bahkan Grab lewat program magang MBKM penting banget buat siapsiap
negatif;kenapa ya ipk di web mbkm bisa beda sama yang di transkrip nilai takut banget mempengaruhi seleksi 
negatif;dah gt proposal sama persiapan mmd yg lain jg belum samsek masyaallah salah satu dari mbkm atau mmd plis yg iya iya ajalah klo ngasi timeline ini keduanya gaje bgt helpp orgil klean
negatif;woi klean yg mbkm fp dan ikut mmd kepalanya ga mledak kan apaansi supervisi di akhir magang gini bok ya pas kita kerja rodi ngono lah kau tengok kita ni kita dah selesai magang apa yang mau kau tengok bocoooo
netral;MBKM  Gagasan bagus namun tidak sedikit yang problematik
positif;collegemenfess Kalo aku sihh sewruu bgttt yaa nderrr soalnya w ambil magang mbkm wkwkwk alias w mo kaburrrr dari derita semester 5 
netral;17Autopia Kalo sekiranya kita ngga ambil atau engga klik konfirmasi next nya masih bisa ikut mbkm lg ngga ya
positif;convomf doakan akuu semoga lolos seleksi mbkm ygy kl iya uangnya mau nabung beli laptop soalnyy sem 5 ntr blm punya laptop gw
netral;teruntuk kakak kakak yang pernah mbkm dapetin sptjm sama sr di itb prosesnya gimana yaa tia 3
netral;collegemenfess kegiatan MBKM gimana kayak kampus mengajar studi independen
netral;UPIfess coba dipikirin dulu keknya ini yang kirim menfess ikut sp yah makanya 35 tahun Mirip case temen angkatanku yang nyesel ambil sp karena dia baru tau ada program mbkm dan boleh 2x Lain kali buat maba kalo mau ikut program apapun perlu dipikirin yah karena semuanya—
negatif;tehhhobeng27 Oh iya ta Kalo misalnya kt lolos trus ga ambil pmm di blacklist dari mbkm
netral;"cm Sender lg ada di 2 posisi yg susah milihnya Sender punya kesempatan 35 tahun dan sender jg punya kesempatan MBKM sekali lg td nya mau dipake ambil MSIB 

Mending kejar 35 atau MSIB"
netral;kemana ya nanti mbkm
positif;itsfess Diperbaiki Emang masih bisa Mending ikut MBKM
netral;KemdikbudRI pddikti Halo min kenapa ya data ipk di web mbkm dan di transkrip nilai bisa berbeda kira kira solusinya bagaimana min
netral;dyaluvr saran dariku bgt sih jangan sampe microteaching sama metopen kamu relain buat dipindah ke semester 8 gitu buat ngulang matkultransfer kredit takut capek aja udh mikir skripsi tapi masih kuliah matkul gitu Mending selesein dulu semuanya baru bebas ikut mbkm All up to you yaa
positif;ipbmenfess Ini incase kyk gw waktu sem 5 tahun lalu yg harusnya mayor masih bnyk tp pgn ikut MBKM Worth it ngikut MBKM yg bisa ngeclaim matkul mayor min 1 lah selebihnya bisa diclaim EC di semester tsbt Jdi sistemnya udh terencana mau claim matkul apa aja dan WAJIB bgt konfirmasi ke
positif;dyaluvr Halo kalo kamu tipe yang ambis mau maksimalin ikut mbkm 2x saranku Sem 34 ikut PMM exchange univ dalam negeri abis itu ikut lagi sem 7 nya KamjarMSIBIISMA Tapi kalo kamu tipe yang penting pernah coba 1x ikut aja di sem 7 dengan syarat kamu udh mateng bgt nih persiapannya
positif;"ego ku untuk ga daftar program MBKM lain terbayarkan alihalih takut ke blacklist PMM
Sumpahh yaa sampe sekarang masih kagetgemetar bisa jadi part of UGM "
netral;simpangantajam Minimal mbkm
netral;"Bagi temanteman yang mengikuti MBKM Batch 5 mungkin binggung terkait point nomor 1 pada SPTJM itu temanteman berarti bukan penerima beasiswa ya karena Beasiswa Kaltim masuk kedalam APBD bukan APBN jadi bisa dipilih tidak sedang menerima

BeasiswaKaltim MSIB"
netral;"Cm GUYS TOLONGIN BANGET Foto2ku waktu mbkm kan mau aku pindah dari hp ke laptop terus waktu udah aku pindah kok foldernya jadi gak ada isinya alias gaada fotonya samsek entah di hpku sama di laptopkkuu ini bisa dicari lagi gak sih YA ALLAH MONANGIS
Ada yg bisa cont"
netral; collegemenfess Kalian tulis di cv nya gimana kalo punya pengalaman magang mbkm cm
negatif;Sedih banget angkatan corona ni offline kuliah semester 2semester 6 baru aktif lagi dikampus Mau ikut kegiatan mbkm udah telat banget takut ambil semester baru
netral;Kalian tulis di cv nya gimana kalo punya pengalaman magang mbkm cm
positif;Workshop Merdeka Belajar Kampus Merdeka MBKM Fakultas Ushuluddin dan Studi Agama FUSA UIN Imam Bonjol Padang Tanggal 2830 Mei 2023 
positif;belom siap daftar mbkm karena ada yang salah di sptjm ternyata diperpanjang ampe 30 Juni  semoga batch 5 ini jadi rezeki saya Ya Allah
netral;hokisetiapsaat kak mau nanya misal di prodi ku mt sem 5 metopen sem 6 sedangkan aku mau ikut mbkm sem 6 ada saran gak ya
netral;compliceited berarti barengan ya teh pas mbkm ngontrak kkn
positif;ssefnum Karna udah paham sama mbkm aku sudah isi 
positif;Siapapun Presidennya mohon banget mendikbudnya kalo bisa Nadiem Makarim lagi Kalo ga bisa minimal mbkm jangan diilangin 
netral;bbabidi utfess terimakasih untuk syarat ada di web kampus merdekanya kak tp khusus ut minimal ikut MBKM itu semester 5 proses minta sptjm nya juga cpt kalo FE kalau fakultas lain kurg tau ceper atau engga
negatif;gd mbkm yg ke rans entertainment apaaa
positif;UPIfess Kalo di prodiku wajib ambil minimal 1 bkp kegiatan di luar kampus dg konversi 20 sks di mana 1 bkp ini bisa diambil dari program mbkm kemdikbud atau upi sendiri
